,Question,Newest Label,Outdated Label
0,Does carpal tunnel release surgery provide better outcomes than non-surgical treatment for carpal tunnel syndrome?,REFUTED,--
1,Is cranberry juice effective for treating urinary tract infections?,SUPPORTED,REFUTED
2,Is add-on lamotrigine effective in reducing seizures for people with drug-resistant focal epilepsy?,SUPPORTED,NOT ENOUGH INFORMATION
3,Do statins help reduce cardiovascular events in adults with chronic kidney disease not requiring dialysis?,SUPPORTED,NOT ENOUGH INFORMATION
4,Do antibiotics effectively reduce pain in children with acute otitis media?,SUPPORTED,NOT ENOUGH INFORMATION
5,Do cranberry products help prevent urinary tract infections in certain populations?,NOT ENOUGH INFORMATION,--
6,Does IVF improve pregnancy outcomes compared to other fertility treatments?,NOT ENOUGH INFORMATION,--
7,Do antioxidant vitamin and mineral supplements help slow the progression of age-related macular degeneration?,NOT ENOUGH INFORMATION,--
8,Does cell salvage reduce the need for blood transfusions in elective surgery?,REFUTED,NOT ENOUGH INFORMATION
9,Is ICSI more effective than c-IVF for couples with normal sperm count and motility?,NOT ENOUGH INFORMATION,--
10,Is clobetasol propionate cream an effective treatment for bullous pemphigoid?,SUPPORTED,--
11,Can interventions help prevent kidney complications in people with sickle cell disease?,SUPPORTED,REFUTED
12,Are combined oral contraceptive pills effective for managing painful menstrual cramps?,SUPPORTED,--
13,Does NIPPV reduce the need for additional ventilatory support compared to NCPAP in preterm infants after extubation?,SUPPORTED,--
14,Is sacral colpopexy a safer and more effective surgical option for apical vaginal prolapse compared to other interventions?,NOT ENOUGH INFORMATION,SUPPORTED
15,Do social network and social support interventions improve outcomes in cardiac rehabilitation for people with heart disease?,NOT ENOUGH INFORMATION,SUPPORTED
16,Does Serenoa repens help improve lower urinary tract symptoms in men with benign prostatic hyperplasia?,SUPPORTED,NOT ENOUGH INFORMATION
17,Does adding pentoxifylline to antibiotic therapy improve outcomes in neonates with sepsis or necrotising enterocolitis?,SUPPORTED,--
18,"Does the effectiveness of nicotine replacement therapy vary based on its form, dose, or timing of use?",NOT ENOUGH INFORMATION,--
19,Does nebulised hypertonic saline improve lung function in people with cystic fibrosis?,SUPPORTED,--
20,Are IL-6 blocking agents effective in treating severe COVID-19 compared to standard care or placebo?,SUPPORTED,REFUTED
21,Can antidepressant medications help people quit smoking cigarettes?,REFUTED,--
22,Does convalescent plasma transfusion reduce mortality in patients with COVID-19?,REFUTED,SUPPORTED
23,Do anticholinergic drugs improve symptoms of overactive bladder compared to placebo?,NOT ENOUGH INFORMATION,--
24,Are airway clearance techniques effective for people with cystic fibrosis?,SUPPORTED,NOT ENOUGH INFORMATION
25,Are mechanical methods for inducing labor as effective and safe as pharmacological methods?,SUPPORTED,--
26,Does postnatal administration of phenobarbital reduce the risk of intraventricular hemorrhage in preterm infants?,SUPPORTED,REFUTED
27,Do antibiotics improve recovery from acute bacterial conjunctivitis compared to no treatment?,SUPPORTED,NOT ENOUGH INFORMATION
28,Does inducing labor for suspected fetal macrosomia reduce the risk of birth complications?,NOT ENOUGH INFORMATION,REFUTED
29,Does planned hospital birth reduce risks for low-risk pregnant women compared to planned home birth?,REFUTED,NOT ENOUGH INFORMATION
30,Do interventions improve adherence to iron chelation therapy in people with sickle cell disease or thalassaemia?,SUPPORTED,REFUTED
31,Does splinting help improve symptoms in people with carpal tunnel syndrome?,SUPPORTED,REFUTED
32,Are treatments for acute non-arteritic central retinal artery occlusion effective?,SUPPORTED,--
33,Does remdesivir improve clinical outcomes in patients with COVID-19 compared to standard care?,SUPPORTED,NOT ENOUGH INFORMATION
34,Is telerehabilitation effective for improving quality of life in people with low vision?,SUPPORTED,--
35,Are glucocorticoids effective in treating croup in children?,REFUTED,SUPPORTED
36,Do bisphosphonates improve bone health in people with cystic fibrosis?,SUPPORTED,NOT ENOUGH INFORMATION
37,Do inhaled corticosteroids help reduce the risk of bronchopulmonary dysplasia in preterm infants?,NOT ENOUGH INFORMATION,REFUTED
38,Do inhaled bronchodilators help reduce complications in acute chest syndrome for people with sickle cell disease?,REFUTED,--
39,Can antibody tests accurately detect current or past SARS-CoV-2 infection?,SUPPORTED,--
40,Are systemic corticosteroids effective in reducing mortality for hospitalized COVID-19 patients?,SUPPORTED,--
41,Does long-term inhaled antibiotic therapy improve lung function in people with cystic fibrosis?,NOT ENOUGH INFORMATION,--
42,Do antifibrinolytic treatments improve outcomes for patients with aneurysmal subarachnoid haemorrhage?,NOT ENOUGH INFORMATION,SUPPORTED
43,Does breastfeeding support increase the duration and exclusivity of breastfeeding among mothers?,SUPPORTED,--
44,Is infant cataract surgery more effective than no surgery for treating bilateral congenital cataracts in children under 2 years old?,SUPPORTED,--
45,Does using tap water for wound cleansing affect healing compared to no cleansing?,SUPPORTED,--
46,Is surgery an effective treatment for obesity in children and adolescents?,SUPPORTED,NOT ENOUGH INFORMATION
47,Do interventions aimed at improving mobility after hip fracture surgery lead to better outcomes than conventional care?,NOT ENOUGH INFORMATION,--
48,Do antifungal treatments improve clinical status in patients with allergic bronchopulmonary aspergillosis and cystic fibrosis?,SUPPORTED,--
49,Does hydroxyurea help reduce pain and complications in people with sickle cell disease?,NOT ENOUGH INFORMATION,REFUTED
50,Does physical activity improve exercise capacity in people with cystic fibrosis?,SUPPORTED,--
51,Does carotid patch angioplasty lower the risk of severe arterial restenosis and recurrent strokes compared to primary closure?,NOT ENOUGH INFORMATION,--
52,Are rapid antigen tests effective for diagnosing SARS-CoV-2 infection?,NOT ENOUGH INFORMATION,--
53,Is vagus nerve stimulation an effective treatment for drug-resistant focal epilepsy?,SUPPORTED,--
54,Does using a shunt during carotid endarterectomy improve patient outcomes?,SUPPORTED,NOT ENOUGH INFORMATION
55,Does surgery provide better outcomes than non-surgical treatment for proximal humeral fractures?,REFUTED,NOT ENOUGH INFORMATION
56,Do WASH interventions help prevent soil-transmitted helminth infections?,NOT ENOUGH INFORMATION,--
57,Can signs and symptoms accurately determine if someone has COVID-19?,SUPPORTED,NOT ENOUGH INFORMATION
58,Does blastocyst-stage embryo transfer improve live birth rates compared to cleavage-stage transfer?,NOT ENOUGH INFORMATION,SUPPORTED
59,Does risedronate help prevent osteoporotic fractures in postmenopausal women?,SUPPORTED,--
60,Is tacrolimus an effective treatment for corticosteroid-refractory ulcerative colitis?,NOT ENOUGH INFORMATION,--
61,Do repeat doses of prenatal corticosteroids improve outcomes for infants at risk of preterm birth?,SUPPORTED,--
62,Do anticoagulants provide benefits for people hospitalized with COVID-19?,SUPPORTED,REFUTED
63,Do medications help reduce PTSD symptoms in adults?,SUPPORTED,NOT ENOUGH INFORMATION
64,Does a structured discharge plan for patients reduce hospital readmissions?,REFUTED,NOT ENOUGH INFORMATION
65,Are cephalomedullary nails more effective than extramedullary fixation implants for treating extracapsular hip fractures in older adults?,NOT ENOUGH INFORMATION,--
66,Does delaying enteral feeding for very preterm or VLBW infants reduce the risk of necrotising enterocolitis or death?,NOT ENOUGH INFORMATION,SUPPORTED
67,Does immediate oral antiplatelet therapy improve outcomes in patients with acute ischaemic stroke?,SUPPORTED,NOT ENOUGH INFORMATION
68,Do self-management interventions improve health-related quality of life for people with COPD compared to usual care?,SUPPORTED,NOT ENOUGH INFORMATION
69,Do orthodontic treatments effectively correct posterior crossbites in children and adolescents?,SUPPORTED,NOT ENOUGH INFORMATION
70,Is a restrictive red blood cell transfusion strategy as effective as a liberal strategy in reducing 30-day mortality?,REFUTED,NOT ENOUGH INFORMATION
71,Does dietary advice improve survival in adults with disease-related malnutrition?,REFUTED,SUPPORTED
72,Is injection sclerotherapy an effective and safe treatment for varicose veins?,SUPPORTED,--
73,Do antibiotics help reduce symptoms of sore throat in patients?,SUPPORTED,--
74,Does providing active information improve knowledge and reduce anxiety in stroke survivors?,SUPPORTED,NOT ENOUGH INFORMATION
75,Does adding growth hormone to IVF treatment improve outcomes for women with infertility?,SUPPORTED,NOT ENOUGH INFORMATION
76,Do macrolides help reduce asthma exacerbations compared to placebo?,SUPPORTED,--
77,Do rotavirus vaccines effectively prevent diarrhoea in children?,NOT ENOUGH INFORMATION,--
78,Do late systemic postnatal corticosteroids help reduce the risks of mortality and bronchopulmonary dysplasia in preterm infants?,REFUTED,--
79,Does exercise-based cardiac rehabilitation improve health outcomes for people with coronary heart disease?,SUPPORTED,NOT ENOUGH INFORMATION
80,Do interventions aimed at women effectively increase cervical screening uptake?,REFUTED,--
81,Does early anticoagulation improve outcomes for patients with acute ischaemic stroke?,SUPPORTED,--
82,Do systemic postnatal corticosteroids help prevent bronchopulmonary dysplasia in preterm infants?,REFUTED,NOT ENOUGH INFORMATION
83,Does starting nasal CPAP early in preterm infants reduce the need for mechanical ventilation and the risk of bronchopulmonary dysplasia?,NOT ENOUGH INFORMATION,SUPPORTED
84,Does carotid endarterectomy under local anaesthetic reduce the risk of stroke and death compared to general anaesthetic?,SUPPORTED,NOT ENOUGH INFORMATION
85,Do oral anticoagulants provide more benefit than risk for cancer patients undergoing treatment?,NOT ENOUGH INFORMATION,--
86,Do antibiotics help prevent infections in cancer patients with long-term central venous catheters?,SUPPORTED,NOT ENOUGH INFORMATION
87,Does surgical management improve ulcer healing in patients with deep venous insufficiency?,NOT ENOUGH INFORMATION,SUPPORTED
88,Does paracetamol help relieve perineal pain after childbirth?,SUPPORTED,NOT ENOUGH INFORMATION
89,Do school-based interventions effectively increase physical activity and improve fitness in children and adolescents?,REFUTED,NOT ENOUGH INFORMATION
90,Do educational meetings improve professional practice and healthcare outcomes?,NOT ENOUGH INFORMATION,--
91,Does patching improve outcomes for children with intermittent exotropia compared to observation?,SUPPORTED,--
92,Is colchicine an effective treatment for acute gout?,SUPPORTED,NOT ENOUGH INFORMATION
93,Does slowly advancing enteral feed volumes reduce the risk of necrotising enterocolitis in very preterm or VLBW infants?,REFUTED,SUPPORTED
94,Does chronic non-invasive ventilation improve outcomes for people with COPD?,REFUTED,--
95,Do PW-led treatments improve mental health outcomes in low- and middle-income countries?,NOT ENOUGH INFORMATION,--
96,Can adjuvant drug treatment improve the outcomes of dialysis access in patients with end-stage renal disease?,SUPPORTED,--
97,Does double intrauterine insemination (IUI) improve pregnancy rates compared to single IUI for subfertile couples?,SUPPORTED,--
98,Is using an opioid effective for treating neonatal abstinence syndrome in newborns?,SUPPORTED,--
99,Do non-pharmacological interventions improve functional ability in people with spatial neglect after stroke?,SUPPORTED,--
100,Is one method of tube feeding more effective than the other for preterm infants under 1500 grams?,SUPPORTED,--
101,Is combination intravenous antibiotic therapy more effective than single therapy for treating respiratory infections in cystic fibrosis?,NOT ENOUGH INFORMATION,--
102,Does early postnatal discharge from hospital affect the health outcomes of mothers and infants?,NOT ENOUGH INFORMATION,--
103,Do anthelmintics help reduce seizures in people with neurocysticercosis?,SUPPORTED,NOT ENOUGH INFORMATION
104,Is using a sedative effective and safe for treating neonatal abstinence syndrome due to opioid withdrawal?,REFUTED,--
105,Does long-term oral anticoagulation reduce deaths and stroke in people with heart failure in sinus rhythm?,NOT ENOUGH INFORMATION,--
106,Does treating gastro-oesophageal reflux disease help improve asthma symptoms?,NOT ENOUGH INFORMATION,REFUTED
107,Do topical emollients reduce the risk of invasive infection in preterm infants?,NOT ENOUGH INFORMATION,--
108,Is quarantine effective in reducing the spread of COVID-19?,REFUTED,SUPPORTED
109,Do drugs that reduce gastric acidity improve fat absorption in people with cystic fibrosis?,REFUTED,SUPPORTED
110,Does treating varicoceles improve pregnancy rates in couples where the male has a varicocele?,NOT ENOUGH INFORMATION,--
111,Are anti-seizure medications effective for reducing seizures in Lennox-Gastaut syndrome?,REFUTED,--
112,Does thromboprophylaxis during pregnancy reduce the risk of venous thromboembolism in at-risk women?,NOT ENOUGH INFORMATION,REFUTED
113,Do international travel-related control measures effectively reduce the spread of infectious diseases during a pandemic?,SUPPORTED,NOT ENOUGH INFORMATION
114,Does dornase alfa improve lung function in cystic fibrosis patients compared to placebo?,SUPPORTED,--
115,Does assisted hatching improve live birth rates in assisted conception?,SUPPORTED,NOT ENOUGH INFORMATION
116,Does zinc supplementation during pregnancy improve maternal and neonatal outcomes?,NOT ENOUGH INFORMATION,REFUTED
117,Does antibiotic prophylaxis reduce the risk of pneumococcal infection in children with sickle cell disease?,REFUTED,SUPPORTED
118,Does home-based end-of-life care increase the likelihood of dying at home?,REFUTED,NOT ENOUGH INFORMATION
119,Is umbilical vein injection of saline or uterotonics effective for treating retained placenta?,SUPPORTED,--
120,Do different classes of antibiotics given before a caesarean section affect the risk of infection in mothers?,NOT ENOUGH INFORMATION,--
121,Do preterm infants grow better on formulas with high medium chain triglycerides compared to those with low medium chain triglycerides?,SUPPORTED,--
122,Is endometrial resection or ablation an effective alternative to hysterectomy for treating heavy menstrual bleeding?,NOT ENOUGH INFORMATION,--
123,Is there a difference in safety and efficacy between synthetic and venous patch materials used in carotid patch angioplasty?,NOT ENOUGH INFORMATION,--
124,Do topical antibiotic treatments help prevent respiratory infections in patients on mechanical ventilation?,REFUTED,--
125,Is ethosuximide the best initial treatment for children and adolescents with absence seizures?,NOT ENOUGH INFORMATION,--
126,Is gabapentin effective as an add-on treatment for drug-resistant focal epilepsy?,REFUTED,NOT ENOUGH INFORMATION
127,Does tyrosine supplementation improve outcomes for people with phenylketonuria?,NOT ENOUGH INFORMATION,--
128,Does reducing sodium intake have an effect on blood pressure?,NOT ENOUGH INFORMATION,REFUTED
129,Do peripheral nerve blocks improve pain management for adults with hip fractures?,REFUTED,--
130,Do pneumococcal conjugate vaccines help prevent acute otitis media in children?,SUPPORTED,NOT ENOUGH INFORMATION
131,Are surgical interventions more effective than non-surgical treatments for basal cell carcinoma?,SUPPORTED,NOT ENOUGH INFORMATION
132,Do low protein diets help slow the progression of chronic kidney disease to end-stage kidney disease?,SUPPORTED,--
133,Is there a beneficial effect of the intervention on patient outcomes?,SUPPORTED,--
134,Does tubal surgery improve pregnancy outcomes in women with hydrosalpinges undergoing assisted reproductive technology?,SUPPORTED,--
135,Does continuous positive airway pressure (CPAP) reduce the need for mechanical ventilation in preterm infants with respiratory distress?,NOT ENOUGH INFORMATION,--
136,Does early initiation of CPAP reduce mortality and the need for ventilation in preterm infants with respiratory distress?,REFUTED,--
137,Does tubal flushing with oil-soluble contrast media improve fertility outcomes in women with subfertility?,REFUTED,NOT ENOUGH INFORMATION
138,Does continuous oral antibiotic prophylaxis improve outcomes in children with cystic fibrosis?,NOT ENOUGH INFORMATION,SUPPORTED
139,Does protein supplementation of human milk improve growth in preterm infants?,SUPPORTED,--
140,Does carotid endarterectomy reduce the risk of recurrent stroke in patients with symptomatic carotid stenosis?,REFUTED,NOT ENOUGH INFORMATION
141,Does supplementing human milk with carbohydrates improve growth and health outcomes in preterm infants?,SUPPORTED,NOT ENOUGH INFORMATION
142,Do different corticosteroid regimens provide benefits for children with steroid-sensitive nephrotic syndrome?,SUPPORTED,--
143,Is oral 5-ASA effective for maintaining remission in ulcerative colitis compared to placebo?,REFUTED,SUPPORTED
144,Is oral anti-fungal treatment more effective than intra-vaginal treatment for uncomplicated vulvovaginal candidiasis?,SUPPORTED,--
145,Does adding fat to human milk improve growth and development in preterm infants?,SUPPORTED,NOT ENOUGH INFORMATION
146,Does reducing saturated fat intake lower the risk of cardiovascular events?,NOT ENOUGH INFORMATION,--
147,Is aromatherapy effective and safe for people with dementia?,SUPPORTED,NOT ENOUGH INFORMATION
148,Is oral 5-aminosalicylic acid effective for inducing remission in ulcerative colitis compared to placebo?,REFUTED,--
149,Does vigabatrin help reduce seizures in people with drug-resistant focal epilepsy?,SUPPORTED,--
150,Do chronic blood transfusions help prevent strokes in children with sickle cell disease?,SUPPORTED,--
151,Do pharmacological treatments improve outcomes for women with intrahepatic cholestasis of pregnancy?,SUPPORTED,--
152,Is zonisamide effective as an add-on treatment for focal epilepsy that is not controlled by other medications?,NOT ENOUGH INFORMATION,--
153,Do fluid and pharmacological agents effectively prevent adhesions in women undergoing gynaecological surgery?,SUPPORTED,NOT ENOUGH INFORMATION
154,Is a low-phenylalanine diet effective for people with phenylketonuria?,SUPPORTED,--
155,Can prophylactic interventions effectively prevent hypotension after spinal anaesthesia for caesarean section?,SUPPORTED,--
156,Does preoperative blood transfusion in people with sickle cell disease reduce complications during surgery?,NOT ENOUGH INFORMATION,SUPPORTED
157,Is early surgical repair beneficial for patients with asymptomatic abdominal aortic aneurysms between 4.0 cm and 5.5 cm in diameter?,SUPPORTED,--
158,Is levetiracetam effective as an add-on treatment for drug-resistant focal epilepsy?,SUPPORTED,NOT ENOUGH INFORMATION
159,Do ketogenic diets help reduce seizures in people with drug-resistant epilepsy?,SUPPORTED,--
160,Do progestogen-releasing intrauterine devices effectively reduce heavy menstrual bleeding?,REFUTED,--
161,Does multi-nutrient fortified human milk improve growth rates in preterm infants without increasing adverse effects?,SUPPORTED,NOT ENOUGH INFORMATION
162,Does pelvic floor muscle training help prevent or treat urinary incontinence in pregnant or postnatal women?,SUPPORTED,NOT ENOUGH INFORMATION
163,Does chelation therapy improve clinical outcomes in people with atherosclerotic cardiovascular disease?,NOT ENOUGH INFORMATION,--
164,Are enuresis alarms effective in treating bedwetting in children?,REFUTED,--
165,Are antiepileptic drugs effective in preventing seizures after craniotomy?,NOT ENOUGH INFORMATION,SUPPORTED
166,Does organised inpatient care for stroke patients lead to better outcomes compared to alternative care services?,NOT ENOUGH INFORMATION,REFUTED
167,Does antibiotic prophylaxis reduce the risk of postoperative wound infections after hernia repair surgery?,REFUTED,NOT ENOUGH INFORMATION
168,Are non-corticosteroid immunosuppressive medications beneficial for children with relapsing steroid-sensitive nephrotic syndrome?,REFUTED,--
169,Does omega-3 supplementation reduce morbidity and mortality in cystic fibrosis patients?,SUPPORTED,REFUTED
170,Do educational and supportive strategies help people with sleep apnea use CPAP devices more effectively?,NOT ENOUGH INFORMATION,--
171,Can interventions effectively reduce silent cerebral infarcts in people with sickle cell disease?,NOT ENOUGH INFORMATION,REFUTED
172,Do breathing exercises help improve asthma management?,SUPPORTED,--
173,Do barrier agents used during pelvic surgery reduce pain and improve live birth rates in women of reproductive age?,NOT ENOUGH INFORMATION,SUPPORTED
174,Do immunosuppression strategies provide benefits for treating IgA nephropathy?,SUPPORTED,--
175,Do vitamins and minerals reduce the risk of lung cancer in healthy people?,NOT ENOUGH INFORMATION,--
176,Do smoking cessation pharmacotherapies and electronic cigarettes help pregnant women quit smoking?,NOT ENOUGH INFORMATION,--
177,Are corticosteroids effective for reducing pain in oral lichen planus?,SUPPORTED,--
178,Is membrane sweeping effective for inducing labour in women at or near term?,NOT ENOUGH INFORMATION,--
179,Is carotid artery stenting safer than carotid endarterectomy for treating carotid stenosis?,NOT ENOUGH INFORMATION,--
180,Does laparoscopic ovarian drilling improve live birth rates in women with PCOS who are resistant to clomiphene citrate?,NOT ENOUGH INFORMATION,--
181,Is ibuprofen effective and safer than indomethacin for closing a patent ductus arteriosus in preterm infants?,NOT ENOUGH INFORMATION,--
182,Can acupuncture and acupressure help manage pain during labor?,NOT ENOUGH INFORMATION,SUPPORTED
183,Is intravenous immunoglobulin effective in preventing nosocomial infections in preterm or low birth weight infants?,NOT ENOUGH INFORMATION,SUPPORTED
184,Does administering intravenous immunoglobulin reduce mortality in neonates with suspected or proven infection?,SUPPORTED,REFUTED
185,Are traditional suburethral sling procedures effective for treating stress urinary incontinence in women?,NOT ENOUGH INFORMATION,--
186,Does ibuprofen effectively prevent patent ductus arteriosus in preterm infants?,NOT ENOUGH INFORMATION,SUPPORTED
187,Do topical agents and wound dressings impact the healing of arterial leg ulcers?,REFUTED,SUPPORTED
188,Is drug therapy effective and safe for managing delirium symptoms in terminally ill adults?,SUPPORTED,NOT ENOUGH INFORMATION
189,Is tonsillectomy an effective treatment for children with PFAPA syndrome?,SUPPORTED,--
190,Do interventions for female drug-using offenders effectively reduce criminal activity or drug use?,NOT ENOUGH INFORMATION,REFUTED
191,Do psychosocial interventions reduce substance use in people with serious mental illness more effectively than standard care?,NOT ENOUGH INFORMATION,SUPPORTED
192,Is laparoscopic colposuspension effective for treating urinary incontinence in women?,NOT ENOUGH INFORMATION,--
193,Does spinal anaesthesia with lidocaine lead to a higher risk of transient neurological symptoms compared to other local anaesthetics?,SUPPORTED,--
194,Are medical therapies effective for preventing or treating pouchitis?,NOT ENOUGH INFORMATION,SUPPORTED
195,Is prophylactic plasma transfusion effective and safe for patients with coagulation test abnormalities undergoing surgery?,SUPPORTED,--
196,Does antibiotic treatment for asymptomatic bacteriuria reduce the risk of complications during pregnancy?,NOT ENOUGH INFORMATION,SUPPORTED
197,Can progestogen therapy help prevent recurrent miscarriages?,REFUTED,NOT ENOUGH INFORMATION
198,Does cognitive rehabilitation improve attention and functional recovery in stroke survivors?,NOT ENOUGH INFORMATION,--
199,Does adding exercise to smoking cessation support help people quit smoking more effectively than support alone?,NOT ENOUGH INFORMATION,--
200,Can antiplatelet agents like low-dose aspirin help prevent pre-eclampsia in at-risk pregnant women?,SUPPORTED,--
201,Does adding intrapleural fibrinolytic therapy to standard treatment improve outcomes for complicated pleural infections?,NOT ENOUGH INFORMATION,--
202,Is routine malaria chemoprophylaxis beneficial for people with sickle cell disease in malaria-endemic areas?,SUPPORTED,REFUTED
203,Is topiramate effective as an add-on treatment for drug-resistant focal epilepsy?,SUPPORTED,REFUTED
204,Is valproate an effective treatment for acute mania in adults with bipolar disorder?,NOT ENOUGH INFORMATION,--
205,Does tiagabine help reduce seizure frequency in people with drug-resistant focal seizures?,NOT ENOUGH INFORMATION,--
206,Do different types of dental implants have varying long-term success rates?,SUPPORTED,NOT ENOUGH INFORMATION
207,Is botulinum toxin type A effective for treating lower limb spasticity in children with cerebral palsy?,REFUTED,--
208,Do interventions for drug-using offenders with mental health problems reduce drug use or criminal activity?,NOT ENOUGH INFORMATION,--
209,Do antibiotics help reduce the risk of active trachoma and ocular infections?,NOT ENOUGH INFORMATION,--
210,Does Tai Chi provide benefits for people with rheumatoid arthritis?,NOT ENOUGH INFORMATION,SUPPORTED
211,Do NSAIDs effectively reduce heavy menstrual bleeding in women?,REFUTED,--
212,Is compression therapy effective in treating post-thrombotic syndrome?,NOT ENOUGH INFORMATION,--
