,Question,Newest Label,Outdated Label
653,Is magnesium sulphate effective in preventing preterm birth in women in threatened preterm labour?,NOT ENOUGH INFORMATION,SUPPORTED
654,Do modifications in the transfer set used in CAPD exchanges reduce peritonitis?,SUPPORTED,--
655,Does not closing the peritoneum during a caesarean section lead to better postoperative outcomes?,REFUTED,--
656,Does bariatric surgery lead to better weight loss and improvement in obesity-related health issues compared to non-surgical treatments?,NOT ENOUGH INFORMATION,--
657,Is vedolizumab effective for treating ulcerative colitis?,SUPPORTED,--
658,Is there a beneficial effect of the treatment on patient outcomes?,SUPPORTED,--
659,Is methotrexate effective for inducing remission in patients with active Crohn's disease?,NOT ENOUGH INFORMATION,--
660,Is praziquantel effective for treating urinary schistosomiasis?,NOT ENOUGH INFORMATION,REFUTED
661,Does the duration of vitamin K antagonist treatment affect the risk of recurrent venous thromboembolism?,REFUTED,NOT ENOUGH INFORMATION
662,Does wearing rings or nail polish by surgical teams affect the rate of postoperative wound infections?,NOT ENOUGH INFORMATION,--
663,Is thrombolytic therapy an effective treatment for acute ischaemic stroke when administered within six hours?,SUPPORTED,--
664,Is there a beneficial effect of the intervention on patient outcomes?,SUPPORTED,--
665,Are oral antibiotics effective for treating acute pyelonephritis in children?,SUPPORTED,NOT ENOUGH INFORMATION
666,Is there a beneficial effect of the intervention on patient outcomes?,SUPPORTED,NOT ENOUGH INFORMATION
667,Is there a beneficial effect of the intervention on patient outcomes?,SUPPORTED,--
668,Is there a beneficial effect of the intervention on patient outcomes?,SUPPORTED,REFUTED
669,Does ambulatory oxygen therapy improve exercise capacity in COPD patients who do not qualify for long-term oxygen therapy?,NOT ENOUGH INFORMATION,SUPPORTED
670,Do vaginal prostaglandins E2 and F2a improve the chances of vaginal delivery compared to placebo?,NOT ENOUGH INFORMATION,--
671,Do psychological interventions for people with cystic fibrosis provide significant benefits beyond standard medical care?,NOT ENOUGH INFORMATION,--
672,Do bronchodilators improve clinical outcomes in infants with acute bronchiolitis?,SUPPORTED,--
673,Is one physiotherapy intervention more effective than another for patients with Parkinson's disease?,SUPPORTED,--
674,Do powered toothbrushes remove plaque more effectively than manual toothbrushes?,NOT ENOUGH INFORMATION,--
675,Is oral misoprostol effective for inducing labor in women with a viable fetus?,NOT ENOUGH INFORMATION,SUPPORTED
676,Does nutritional intervention help prevent or treat pressure ulcers?,SUPPORTED,--
677,Does methotrexate provide significant benefits for treating rheumatoid arthritis compared to placebo?,REFUTED,--
678,Is flupenthixol decanoate effective compared to other treatments for schizophrenia?,SUPPORTED,REFUTED
679,Is a cholesterol-lowering diet effective in reducing heart disease and cholesterol levels in people with familial hypercholesterolaemia?,NOT ENOUGH INFORMATION,--
680,Do calcium channel blockers improve outcomes for women in preterm labor compared to other treatments?,NOT ENOUGH INFORMATION,--
681,Are longer-acting erythropoiesis-stimulating agents as effective and safe as traditional treatments for anemia in dialysis patients?,SUPPORTED,NOT ENOUGH INFORMATION
682,Does trypanocidal therapy help prevent chronic chagasic cardiomyopathy in infected individuals?,REFUTED,NOT ENOUGH INFORMATION
683,Do oral medicinal plant products provide benefits for treating osteoarthritis?,SUPPORTED,--
684,Is zolmitriptan effective for treating acute migraine attacks in adults?,SUPPORTED,--
685,Do group-based parenting programmes improve parental psychosocial wellbeing?,REFUTED,NOT ENOUGH INFORMATION
686,Does postoperative chemotherapy combined with radiotherapy improve outcomes for patients with anaplastic oligodendrogliomas or mixed oligoastrocytomas?,SUPPORTED,--
687,Does bone augmentation improve the success of sinus lift procedures for dental implants?,SUPPORTED,REFUTED
688,Does intermittent pneumatic compression help heal venous leg ulcers?,REFUTED,NOT ENOUGH INFORMATION
689,Are inhaled hyperosmolar substances effective in treating bronchiectasis?,SUPPORTED,--
690,Are nitric oxide donors effective in delaying birth during threatened preterm labour?,SUPPORTED,--
691,Do anticoagulant drugs improve walking capacity in patients with intermittent claudication?,SUPPORTED,--
692,Is carbamazepine an effective treatment for schizophrenia?,REFUTED,--
693,Are mucolytic agents effective in treating bronchiectasis?,SUPPORTED,--
694,Is digitalis effective in treating heart failure in patients with normal sinus rhythm?,REFUTED,SUPPORTED
695,Is land-based therapeutic exercise beneficial for people with hip osteoarthritis?,REFUTED,NOT ENOUGH INFORMATION
696,Is physical rehabilitation effective for recovery of function and mobility after a stroke?,NOT ENOUGH INFORMATION,REFUTED
697,Is there a beneficial effect of the intervention on patient outcomes?,SUPPORTED,--
698,Can vitamin D and calcium supplements help prevent fractures in older adults?,SUPPORTED,--
699,Is sulpiride effective for treating schizophrenia compared to placebo?,SUPPORTED,NOT ENOUGH INFORMATION
700,Is carbamazepine effective for treating chronic neuropathic pain and fibromyalgia?,SUPPORTED,--
701,Is paroxetine effective in treating Major Depressive Disorder compared to other antidepressants?,NOT ENOUGH INFORMATION,--
702,Does magnesium supplementation during pregnancy improve maternal and infant health outcomes?,NOT ENOUGH INFORMATION,--
703,Do hip protectors help reduce the risk of hip fractures in older adults?,NOT ENOUGH INFORMATION,REFUTED
704,Does amnioinfusion for preterm premature rupture of membranes improve perinatal and maternal outcomes?,REFUTED,SUPPORTED
705,Do preoperative smoking interventions help reduce postoperative complications?,SUPPORTED,--
706,Does using pulse oximetry during surgery improve patient outcomes?,SUPPORTED,--
707,Is active rehabilitation after lumbar disc surgery more effective than no treatment?,SUPPORTED,--
708,Is influenza vaccination effective for people with cystic fibrosis?,SUPPORTED,--
709,Do psychological treatments help people with thalassaemia cope better with their condition?,REFUTED,NOT ENOUGH INFORMATION
710,Does the timing and volume of intravenous fluid administration affect mortality in trauma patients with haemorrhagic shock?,NOT ENOUGH INFORMATION,--
711,Is there a specific type of intraocular lens that improves visual outcomes for people with uveitis undergoing cataract surgery?,SUPPORTED,--
712,Do workplace interventions help workers to stop smoking?,NOT ENOUGH INFORMATION,SUPPORTED
713,Are Echinacea preparations effective for preventing or treating the common cold?,SUPPORTED,--
714,Does the use of 5-Fluorouracil during glaucoma surgery help lower intraocular pressure?,SUPPORTED,NOT ENOUGH INFORMATION
715,Is there a beneficial effect of the intervention on patient outcomes?,SUPPORTED,--
716,Is there a beneficial effect of the treatment on patient outcomes?,REFUTED,--
717,Is oxytocin infusion more effective than misoprostol for treating primary postpartum haemorrhage?,REFUTED,--
718,Do behavioral or psychological treatments reduce the frequency of non-epileptic seizures or improve quality of life?,NOT ENOUGH INFORMATION,--
719,Is elective delivery at 37 weeks safe for women with uncomplicated twin pregnancies?,SUPPORTED,--
720,Is buprenorphine effective in managing opioid dependence compared to methadone and placebo?,SUPPORTED,REFUTED
721,Is continuous passive motion effective in improving recovery after knee arthroplasty?,SUPPORTED,--
722,Does treatment improve outcomes for twin-twin transfusion syndrome?,SUPPORTED,NOT ENOUGH INFORMATION
723,Does short hospital stays for serious mental illness lead to better outcomes compared to long stays?,REFUTED,--
724,Is acupuncture effective for helping people quit smoking?,REFUTED,--
725,Does amnioinfusion improve perinatal outcomes in cases of meconium-stained amniotic fluid?,NOT ENOUGH INFORMATION,--
726,Is perazine effective for treating schizophrenia compared to other treatments?,REFUTED,NOT ENOUGH INFORMATION
727,Do management strategies for faecal incontinence and constipation improve outcomes for people with neurological diseases?,NOT ENOUGH INFORMATION,--
728,Is omalizumab effective in treating asthma compared to placebo or conventional therapy?,NOT ENOUGH INFORMATION,REFUTED
729,Does intravascular brachytherapy help maintain artery openness after angioplasty or stent insertion?,REFUTED,NOT ENOUGH INFORMATION
730,Is chlorpromazine effective for treating schizophrenia compared to placebo?,NOT ENOUGH INFORMATION,SUPPORTED
731,Does intravenous immunoglobulin improve disability in patients with chronic inflammatory demyelinating polyradiculoneuropathy?,NOT ENOUGH INFORMATION,--
732,Is radiofrequency ablation beneficial for patients with hepatocellular carcinoma compared to other treatments?,SUPPORTED,--
733,Does electromagnetic field therapy provide benefits for treating osteoarthritis?,SUPPORTED,--
734,Does using noninvasive positive-pressure ventilation reduce mortality compared to invasive ventilation in patients with respiratory failure?,SUPPORTED,--
735,Does manual fetal manipulation improve fetal wellbeing during testing?,SUPPORTED,--
736,Does fetal vibroacoustic stimulation improve the efficiency of fetal heart rate testing?,SUPPORTED,--
737,Do prophylactic antibiotics improve outcomes for women in preterm labour with intact membranes?,NOT ENOUGH INFORMATION,--
738,Do anti-hypertensive drugs improve outcomes in patients with both high blood pressure and peripheral arterial disease?,REFUTED,--
739,Is there a superior surgical technique for treating cervical intraepithelial neoplasia?,SUPPORTED,--
740,Does using vasopressin and tranexamic acid help reduce blood loss during cervical surgery?,REFUTED,--
741,Do different methods of cleansing and dressing orthopaedic pin sites affect infection rates?,SUPPORTED,--
742,Do antibiotics given to women with preterm rupture of membranes improve neonatal health outcomes?,NOT ENOUGH INFORMATION,--
743,Is there a beneficial effect of the intervention on patient outcomes?,NOT ENOUGH INFORMATION,--
744,Does first-line chemotherapy improve survival in patients with extensive small cell lung cancer compared to supportive care?,SUPPORTED,--
745,Does single dose dipyrone effectively relieve acute postoperative pain?,SUPPORTED,NOT ENOUGH INFORMATION
746,Is there a beneficial effect of the intervention on patient outcomes?,REFUTED,--
747,Is there a beneficial effect of the intervention on patient outcomes?,SUPPORTED,--
748,Is there a beneficial effect of the intervention on patient outcomes?,SUPPORTED,--
749,Does adding prenatal TRH to corticosteroids help prevent neonatal respiratory disease in preterm infants?,REFUTED,SUPPORTED
750,Does screening for oral cancer reduce mortality rates?,REFUTED,NOT ENOUGH INFORMATION
751,Is haloperidol effective for managing schizophrenia compared to placebo?,SUPPORTED,--
752,Does computerized advice on drug dosage improve patient outcomes compared to routine care?,REFUTED,--
753,Does combining inhaled corticosteroids and long-acting beta2-agonists reduce COPD exacerbations compared to placebo?,REFUTED,--
754,Do glycoprotein IIb/IIIa blockers improve outcomes for patients undergoing PCI or with NSTEACS?,REFUTED,--
755,Is pimozide effective for treating schizophrenia compared to other antipsychotic medications?,SUPPORTED,--
756,Is hydration effective in preventing preterm birth in women with preterm labour?,NOT ENOUGH INFORMATION,--
757,Is continuous negative extrathoracic pressure or non-invasive CPAP effective in improving outcomes for children with acute hypoxaemic respiratory failure?,SUPPORTED,--
758,Do urodynamic tests improve clinical outcomes for urinary incontinence treatment?,SUPPORTED,--
759,Is there a beneficial effect of the treatment on patient outcomes?,NOT ENOUGH INFORMATION,--
760,Is there a beneficial effect of the intervention on patient outcomes?,SUPPORTED,--
761,Is there a beneficial effect of the intervention on patient outcomes?,NOT ENOUGH INFORMATION,--
762,Is celecoxib effective for relieving moderate to severe postoperative pain?,NOT ENOUGH INFORMATION,--
763,Is there a beneficial effect of the intervention on patient outcomes?,SUPPORTED,--
764,Are third wave cognitive and behavioral therapies effective for treating acute depression compared to other psychological therapies?,NOT ENOUGH INFORMATION,SUPPORTED
765,Are third wave cognitive and behavioural therapies effective for treating acute depression?,SUPPORTED,--
766,Is valproate effective in the long-term treatment of bipolar disorder?,SUPPORTED,REFUTED
767,Are behavioural therapies as effective as other psychological therapies for treating acute depression?,NOT ENOUGH INFORMATION,--
768,Is there a beneficial effect of the intervention on patient outcomes?,REFUTED,--
769,Does user-held clinical information improve outcomes for people with severe mental illness?,SUPPORTED,--
770,Do different partner notification strategies effectively reduce the transmission of sexually transmitted infections?,SUPPORTED,--
771,Does hyperbaric oxygen therapy improve the success of dental implants in patients who have undergone radiotherapy?,NOT ENOUGH INFORMATION,--
772,Does physical training improve the health of people with asthma?,NOT ENOUGH INFORMATION,--
773,Does active chest compression-decompression CPR improve survival or neurological function in cardiac arrest patients?,NOT ENOUGH INFORMATION,SUPPORTED
774,Does intravenous immunoglobulin therapy reduce mortality in patients with bacterial sepsis or septic shock?,SUPPORTED,--
775,Are metered-dose inhalers with holding chambers as effective as nebulisers for treating acute asthma?,SUPPORTED,NOT ENOUGH INFORMATION
776,Is supported employment effective for people with severe mental disorders?,SUPPORTED,--
777,Is planned immediate caesarean delivery better than planned vaginal birth for women in preterm labour?,REFUTED,--
778,Is physiotherapy effective in improving outcomes for patients with Parkinson's disease compared to no intervention?,SUPPORTED,--
779,Is inspiratory muscle training effective for improving asthma symptoms?,SUPPORTED,--
780,Do zygomatic implants provide benefits over traditional bone augmentation methods for severely resorbed maxillae?,SUPPORTED,--
781,Does prophylactic D-penicillamine prevent retinopathy of prematurity in preterm infants?,REFUTED,--
782,Is sympathectomy an effective treatment for neuropathic pain?,SUPPORTED,--
783,Does physical conditioning help workers with back pain return to work faster?,SUPPORTED,--
784,Do combined long-acting beta2-agonists and inhaled corticosteroids improve treatment outcomes for COPD compared to inhaled corticosteroids alone?,SUPPORTED,--
785,Are opioid agonists effective and safe for treating neuropathic pain?,REFUTED,--
786,Is there an optimal dose range for haloperidol in treating acute schizophrenia?,NOT ENOUGH INFORMATION,--
787,Does adding inhaled anticholinergics to SABAs improve outcomes for children with acute asthma exacerbations?,SUPPORTED,--
788,Do antibiotics help prevent complications in children with measles?,SUPPORTED,--
789,Does reducing light exposure in very low birth weight infants decrease the risk of retinopathy of prematurity?,SUPPORTED,--
790,Is mannitol therapy effective in managing intracranial pressure after severe head injury?,NOT ENOUGH INFORMATION,--
791,Are systemic prophylactic antibiotics beneficial for reducing dental implant failures?,SUPPORTED,--
792,Are different antihypertensive drugs equally effective for treating very high blood pressure during pregnancy?,SUPPORTED,NOT ENOUGH INFORMATION
793,Does castor oil effectively induce labor compared to other methods?,REFUTED,NOT ENOUGH INFORMATION
794,Are simple behavioural interventions effective for treating nocturnal enuresis in children?,NOT ENOUGH INFORMATION,--
795,Does lowering homocysteine levels improve outcomes in people with peripheral arterial disease?,SUPPORTED,--
796,Do enemas during the first stage of labour improve maternal and neonatal outcomes?,NOT ENOUGH INFORMATION,--
797,Do prison visit programs help reduce delinquency in at-risk youth?,SUPPORTED,NOT ENOUGH INFORMATION
798,Is once daily administration of low molecular weight heparin as safe and effective as twice daily administration?,SUPPORTED,--
799,Is there a beneficial effect of the intervention on patient outcomes?,REFUTED,NOT ENOUGH INFORMATION
800,Is fluoride varnish effective in preventing dental caries in children and adolescents?,SUPPORTED,--
801,Does adding antiplatelet therapy to oral anticoagulation improve safety and efficacy for patients with prosthetic heart valves?,SUPPORTED,--
802,Are vaginal cones effective in managing female urinary stress incontinence?,SUPPORTED,--
803,Do certain antibiotic prophylaxes help prevent urinary tract infections in adults with short-term catheterization?,SUPPORTED,NOT ENOUGH INFORMATION
804,Do surgical techniques improve outcomes for adults with faecal incontinence compared to non-surgical options?,REFUTED,SUPPORTED
805,Do steroids improve hearing in patients with sudden sensorineural hearing loss?,NOT ENOUGH INFORMATION,--
806,Is beta-lactam monotherapy more effective than beta-lactam-aminoglycoside combination therapy for treating febrile neutropenia in cancer patients?,NOT ENOUGH INFORMATION,SUPPORTED
807,Does screening for lung cancer reduce mortality?,NOT ENOUGH INFORMATION,--
808,Do interventions aimed at supporting parents after perinatal death improve their outcomes?,REFUTED,NOT ENOUGH INFORMATION
809,Are tricyclic drugs effective for treating depression in children and adolescents?,REFUTED,SUPPORTED
810,Does dehumidification of the home environment improve asthma control?,NOT ENOUGH INFORMATION,--
811,Is drug therapy effective for treating faecal incontinence?,NOT ENOUGH INFORMATION,--
812,Should a tourniquet be recommended during varicose vein surgery?,NOT ENOUGH INFORMATION,--
813,Are SSRIs effective for treating premenstrual syndrome?,SUPPORTED,--
814,Does iron therapy improve psychomotor development and cognitive function in young children with iron deficiency anaemia?,SUPPORTED,--
815,Do opioid antagonists help people quit smoking for the long term?,SUPPORTED,--
816,Does cognitive training improve outcomes for people with mild Alzheimer's disease or vascular dementia?,NOT ENOUGH INFORMATION,--
817,Is there a preferred pharmaceutical treatment for infantile spasms that effectively controls seizures and improves long-term outcomes?,REFUTED,NOT ENOUGH INFORMATION
818,Does mammographic screening for breast cancer reduce mortality?,NOT ENOUGH INFORMATION,SUPPORTED
819,Does increasing fruit and vegetable consumption help prevent cardiovascular disease?,REFUTED,SUPPORTED
820,Do glucocorticoids improve outcomes in children with acute viral bronchiolitis?,NOT ENOUGH INFORMATION,SUPPORTED
821,Do antibiotics help reduce symptoms of the common cold?,SUPPORTED,--
822,Is autoinflation an effective treatment for otitis media with effusion?,SUPPORTED,NOT ENOUGH INFORMATION
823,Is etanercept more effective than traditional DMARDs for treating rheumatoid arthritis?,NOT ENOUGH INFORMATION,REFUTED
824,Are topical and oral NSAIDs effective for treating lateral elbow pain?,SUPPORTED,--
825,Are drug therapies effective in treating sleep apnoea?,SUPPORTED,--
826,Are proton pump inhibitors more effective than H2-receptor antagonists for treating heartburn in adults?,NOT ENOUGH INFORMATION,--
827,Does folic or folinic acid supplementation reduce side effects in rheumatoid arthritis patients treated with methotrexate?,REFUTED,SUPPORTED
828,Is magnesium maintenance therapy effective in preventing preterm birth after threatened preterm labour?,SUPPORTED,--
829,"Are different thrombolytic agents, doses, and routes of administration effective for treating acute ischaemic stroke?",REFUTED,NOT ENOUGH INFORMATION
830,Does physician advice help people quit smoking?,REFUTED,--
831,Does antiretroviral therapy in HIV-infected individuals reduce the risk of HIV transmission to their uninfected partners?,REFUTED,--
832,Should somatostatin analogues be used routinely in pancreatic surgery?,SUPPORTED,--
833,Does temozolomide provide benefits for treating high grade glioma?,SUPPORTED,--
834,Does a longer-term modest reduction in salt intake lower blood pressure?,NOT ENOUGH INFORMATION,--
835,Is the contraceptive effectiveness of the patch or vaginal ring similar to that of oral contraceptives?,SUPPORTED,--
836,Do school-based interventions help prevent young people from starting smoking?,NOT ENOUGH INFORMATION,--
837,Does garlic have a beneficial effect on walking distance in patients with peripheral arterial occlusive disease?,SUPPORTED,--
838,Is therapeutic ultrasound effective for treating carpal tunnel syndrome?,NOT ENOUGH INFORMATION,SUPPORTED
839,Does thromboprophylaxis reduce mortality in trauma patients?,SUPPORTED,NOT ENOUGH INFORMATION
840,Is there a preferred initial treatment for symptomatic patent ductus arteriosus in preterm infants?,NOT ENOUGH INFORMATION,--
841,Does the timing of loading dental implants affect their success rates?,NOT ENOUGH INFORMATION,--
842,Is functional treatment more effective than immobilisation for acute ankle sprains?,NOT ENOUGH INFORMATION,--
843,Is there a specific functional treatment strategy that is most effective for acute lateral ankle ligament ruptures?,SUPPORTED,REFUTED
844,Do calcium antagonists help reduce seizures in people with drug-resistant epilepsy?,SUPPORTED,--
845,Does interprofessional education improve collaboration and patient care compared to traditional education methods?,REFUTED,--
846,Do perioperative NSAIDs reduce the risk of heterotopic bone formation after hip surgery?,REFUTED,--
847,Is buflomedil effective for treating intermittent claudication?,NOT ENOUGH INFORMATION,SUPPORTED
848,Does early trophic feeding improve outcomes for very preterm or very low birth weight infants compared to enteral fasting?,SUPPORTED,--
849,Does starting induction of labour in the evening improve outcomes compared to morning induction?,REFUTED,--
850,Is therapeutic exercise effective in improving symptoms for people with osteoarthritis?,NOT ENOUGH INFORMATION,--
851,Does spinal cord stimulation improve limb salvage and clinical outcomes in patients with chronic critical leg ischaemia?,SUPPORTED,--
852,Does using lower tidal volume ventilation improve survival in patients with acute respiratory distress syndrome?,REFUTED,--
853,Is transpyloric feeding more beneficial than gastric feeding for preterm infants?,NOT ENOUGH INFORMATION,REFUTED
854,Is tapered methadone effective in managing opioid withdrawal compared to other treatments?,NOT ENOUGH INFORMATION,--
855,Is ultrasound therapy effective for treating patellofemoral knee pain syndrome?,REFUTED,--
856,Is cyclophosphamide more effective than methylprednisolone for treating neuropsychiatric symptoms in systemic lupus erythematosus?,REFUTED,--
857,Does personalised risk communication improve informed decision making for screening tests?,NOT ENOUGH INFORMATION,SUPPORTED
858,Are antischistosomal drugs effective in treating Schistosoma mansoni infection?,NOT ENOUGH INFORMATION,--
859,Is influenza vaccination effective and safe for people with asthma?,SUPPORTED,--
860,Is the sliding hip screw more effective than fixed nail plates for treating hip fractures?,SUPPORTED,--
861,Does selenium supplementation help prevent cardiovascular disease?,SUPPORTED,--
862,Is it safe for obese pregnant women to intentionally lose weight during pregnancy?,REFUTED,NOT ENOUGH INFORMATION
863,Does interferon monotherapy retreatment provide significant clinical benefits for chronic hepatitis C patients?,SUPPORTED,--
864,Does therapeutic hypothermia improve outcomes for newborns with hypoxic ischaemic encephalopathy?,SUPPORTED,NOT ENOUGH INFORMATION
865,Is there a significant difference in effectiveness and safety between single depot GnRHa and daily GnRHa doses in women undergoing IVF?,NOT ENOUGH INFORMATION,--
866,Are pressure-relieving interventions effective in healing foot ulcers in people with diabetes?,NOT ENOUGH INFORMATION,SUPPORTED
867,Does Ginkgo biloba extract help prevent the progression of age-related macular degeneration?,NOT ENOUGH INFORMATION,SUPPORTED
868,Do skin grafts improve healing of venous leg ulcers?,SUPPORTED,--
869,Does vitamin C help reduce the duration or severity of the common cold?,SUPPORTED,--
870,Do pneumococcal polysaccharide vaccines effectively prevent pneumococcal disease or death in adults?,SUPPORTED,--
871,Can antibiotic treatment of bacterial vaginosis in pregnancy reduce the risk of preterm birth?,NOT ENOUGH INFORMATION,--
872,Is there a significant difference in the efficacy and safety of different instruments and techniques for obtaining chorionic tissue in early pregnancy?,REFUTED,--
873,Does percutaneous transluminal rotational atherectomy improve outcomes for patients with complex coronary artery lesions?,SUPPORTED,--
874,Do interventions for healthcare providers that promote patient-centred care improve clinical consultations?,SUPPORTED,--
875,Does adding intravenous aminophylline to inhaled beta(2)-agonists improve treatment outcomes for adults with acute asthma in the emergency department?,SUPPORTED,NOT ENOUGH INFORMATION
876,Is inhaled corticosteroid therapy effective for improving outcomes in acute asthma after emergency department discharge?,SUPPORTED,--
877,Do inhaled corticosteroids help reduce hospital admissions for patients with acute asthma?,REFUTED,SUPPORTED
