,Question,Newest Label,Outdated Label
430,Does postoperative radiotherapy improve survival and reduce recurrence in patients with completely resected non-small cell lung cancer?,REFUTED,--
431,Does out-of-home day-care for preschool children positively impact their development and future success?,SUPPORTED,--
432,Are bisphosphonates effective in preventing and treating bone loss caused by corticosteroids?,SUPPORTED,--
433,Is immunotherapy effective for treating IgM anti-MAG paraprotein-associated demyelinating neuropathy?,NOT ENOUGH INFORMATION,REFUTED
434,Does non-nutritive sucking improve feeding and stability in preterm infants?,SUPPORTED,--
435,Is risperidone as effective as other atypical antipsychotic drugs for treating schizophrenia?,REFUTED,--
436,Does prophylactic plasma transfusion reduce bleeding risk before central line insertion in patients with abnormal coagulation?,SUPPORTED,--
437,Is oral anticoagulant therapy more effective than antiplatelet agents for improving survival in heart failure patients with sinus rhythm?,SUPPORTED,--
438,Is fast-track cardiac care safe and effective compared to conventional care for patients undergoing cardiac surgery?,SUPPORTED,--
439,Is managing patients at home an effective alternative to inpatient hospital care for some elderly patients?,SUPPORTED,--
440,Does Therapeutic Touch help in healing acute wounds?,SUPPORTED,NOT ENOUGH INFORMATION
441,Does cognitive rehabilitation improve memory outcomes for stroke patients in the short term?,NOT ENOUGH INFORMATION,REFUTED
442,Does synchronised mechanical ventilation improve gas exchange compared to conventional ventilation?,SUPPORTED,--
443,Do plasma expanders help prevent ovarian hyperstimulation syndrome in high-risk women undergoing IVF or ICSI?,NOT ENOUGH INFORMATION,SUPPORTED
444,Do intra-vaginal oestrogenic preparations help relieve symptoms of vaginal atrophy in postmenopausal women?,NOT ENOUGH INFORMATION,--
445,Is kangaroo mother care beneficial for low birthweight infants compared to conventional neonatal care?,SUPPORTED,--
446,Does vitamin A supplementation reduce the risk of chronic lung disease in very low birth weight infants?,REFUTED,NOT ENOUGH INFORMATION
447,Are alternative agents to platelet transfusions safe and effective for preventing bleeding in patients with blood cancers undergoing chemotherapy?,REFUTED,--
448,Is tubal sterilisation a safe and effective method of contraception?,NOT ENOUGH INFORMATION,--
449,Are group-based parenting programmes effective in improving the emotional and behavioural adjustment of young children?,REFUTED,--
450,Are fluoride mouthrinses effective in preventing dental caries in children and adolescents?,NOT ENOUGH INFORMATION,--
451,Do treatments for oral leukoplakia effectively prevent oral cancer?,NOT ENOUGH INFORMATION,--
452,Does anti-tuberculous therapy help maintain remission in Crohn's disease?,SUPPORTED,--
453,Is corticosteroid therapy effective for treating Bell's palsy?,SUPPORTED,REFUTED
454,Is sucrose effective for relieving procedural pain in neonates?,REFUTED,NOT ENOUGH INFORMATION
455,Does postoperative epidural analgesia with local anaesthetics improve gastrointestinal recovery after abdominal surgery?,NOT ENOUGH INFORMATION,--
456,Are aminosalicylates effective for treating mildly to moderately active Crohn's disease?,SUPPORTED,NOT ENOUGH INFORMATION
457,Is acupuncture effective in reducing headache frequency in adults with episodic migraine?,SUPPORTED,--
458,Does inhaled nitric oxide reduce mortality in patients with acute respiratory distress syndrome?,REFUTED,--
459,Is speech and language therapy effective for improving communication in stroke patients with aphasia?,SUPPORTED,--
460,Are regular follow-up examinations effective in improving outcomes for women treated for breast cancer?,NOT ENOUGH INFORMATION,--
461,Is high-dose chemotherapy with autograft effective for women with early poor prognosis breast cancer?,REFUTED,NOT ENOUGH INFORMATION
462,Does antibiotic treatment reduce the risk of recurrent toxoplasma retinochoroiditis?,SUPPORTED,NOT ENOUGH INFORMATION
463,Is there a beneficial effect of the intervention on patient outcomes?,SUPPORTED,--
464,Does prophylactic barbiturate therapy reduce death or neurodevelopmental disability in infants after perinatal asphyxia?,NOT ENOUGH INFORMATION,--
465,Is there a beneficial effect of the intervention on patient outcomes?,SUPPORTED,--
466,Are alpha2-adrenergic agonists effective in managing opioid withdrawal symptoms?,SUPPORTED,--
467,Do granulocyte transfusions help reduce mortality in people with neutropenia when used with antibiotics?,SUPPORTED,NOT ENOUGH INFORMATION
468,Are GnRH antagonists more effective and safer than GnRH agonists for ovarian stimulation in assisted conception?,NOT ENOUGH INFORMATION,--
469,Do corticosteroids help reduce death rates in people with tuberculous meningitis?,NOT ENOUGH INFORMATION,SUPPORTED
470,Does wearing surgical face masks during clean surgery reduce the risk of postoperative wound infections?,REFUTED,--
471,Are non-surgical interventions effective and safe for managing late radiation proctopathy?,REFUTED,--
472,Is there a beneficial effect of the intervention on patient outcomes?,SUPPORTED,NOT ENOUGH INFORMATION
473,Is oral morphine effective in relieving cancer pain?,REFUTED,--
474,Is the combination of sumatriptan and naproxen effective for treating acute migraine attacks?,NOT ENOUGH INFORMATION,--
475,Is acupuncture effective in reducing the frequency of tension-type headaches?,NOT ENOUGH INFORMATION,--
476,Does H. pylori eradication therapy help heal peptic ulcers and prevent their recurrence?,NOT ENOUGH INFORMATION,--
477,Does glutamine supplementation improve health outcomes in preterm infants?,SUPPORTED,--
478,Is depot risperidone more effective than placebo for treating schizophrenia?,SUPPORTED,--
479,Do organisational interventions improve healthcare for persons with an intellectual disability?,SUPPORTED,--
480,Is there a beneficial effect of the treatment on patient outcomes?,SUPPORTED,--
481,Does oral immunoglobulin reduce the incidence of necrotizing enterocolitis in preterm or low birth weight neonates?,REFUTED,--
482,Are dietary supplements effective and safe for treating dysmenorrhoea?,NOT ENOUGH INFORMATION,--
483,Do advanced fluid optimization methods improve outcomes for patients undergoing hip fracture surgery?,NOT ENOUGH INFORMATION,--
484,Is therapist-supported Internet cognitive behavioral therapy effective for treating anxiety disorders in adults?,SUPPORTED,NOT ENOUGH INFORMATION
485,Is there a beneficial effect of the intervention on patient outcomes?,SUPPORTED,--
486,Are different fertility treatments effective for couples with male subfertility?,SUPPORTED,--
487,Is there a beneficial effect of the intervention on patient outcomes?,REFUTED,NOT ENOUGH INFORMATION
488,Is there a difference in outcomes between regional and general anaesthesia for hip fracture repair?,NOT ENOUGH INFORMATION,SUPPORTED
489,Is surgery more effective than medical therapy for treating heavy menstrual bleeding?,NOT ENOUGH INFORMATION,--
490,Is there a beneficial effect of the intervention on patient outcomes?,NOT ENOUGH INFORMATION,--
491,Does rHuEPO treatment in predialysis patients improve quality of life without increasing adverse events?,SUPPORTED,--
492,Are tricyclic drugs effective for treating bedwetting in children?,NOT ENOUGH INFORMATION,SUPPORTED
493,Do pre-employment examinations help prevent occupational injuries and diseases?,NOT ENOUGH INFORMATION,--
494,Is surgery effective for managing intestinal obstruction in patients with advanced gynaecological and gastrointestinal cancer?,SUPPORTED,NOT ENOUGH INFORMATION
495,Is there a beneficial effect of the intervention on patient outcomes?,REFUTED,--
496,Do statins prevent dementia in people at risk due to age?,NOT ENOUGH INFORMATION,--
497,Is the serum galactomannan test effective for diagnosing invasive aspergillosis in immunocompromised patients?,REFUTED,--
498,Is there a beneficial effect of the intervention on patient outcomes?,SUPPORTED,NOT ENOUGH INFORMATION
499,Does analyzing fetal ECG waveforms during labor improve fetal outcomes compared to other monitoring methods?,SUPPORTED,--
500,Do 'as required' medication regimens effectively treat psychotic symptoms compared to regular medication patterns?,REFUTED,SUPPORTED
501,Is there a beneficial effect of the intervention on patient outcomes?,SUPPORTED,REFUTED
502,Is home intravenous antibiotic therapy for cystic fibrosis as effective as inpatient therapy?,NOT ENOUGH INFORMATION,--
503,Do oral corticosteroids help improve lung function in cystic fibrosis?,SUPPORTED,NOT ENOUGH INFORMATION
504,Is there a beneficial effect of the treatment on patient outcomes?,SUPPORTED,--
505,Is crisis-intervention care effective for treating serious mental illnesses during acute episodes?,SUPPORTED,--
506,Are different surgical methods effective for treating complete rectal prolapse?,SUPPORTED,--
507,Does adding a long-acting beta2-agonist to inhaled corticosteroids improve asthma management in children?,NOT ENOUGH INFORMATION,--
508,Do diuretics help reduce the duration of respiratory symptoms in newborns with transient tachypnoea?,SUPPORTED,--
509,Do different platelet transfusion thresholds affect the risk of bleeding in patients undergoing chemotherapy or stem cell transplantation?,SUPPORTED,--
510,Do vitamin D preparations help improve bone health in children with chronic kidney disease?,REFUTED,--
511,Is there a beneficial effect of the intervention on patient outcomes?,REFUTED,--
512,Is a single-dose antibiotic treatment for asymptomatic bacteriuria in pregnant women as effective as longer treatments?,SUPPORTED,--
513,Is there a beneficial effect of the intervention on patient outcomes?,NOT ENOUGH INFORMATION,--
514,Is multifetal reduction a viable option for managing multiple pregnancies?,SUPPORTED,REFUTED
515,Does routine ICP monitoring in severe coma reduce the risk of death or severe disability?,NOT ENOUGH INFORMATION,SUPPORTED
516,Is azathioprine effective for maintaining remission in quiescent Crohn's disease?,SUPPORTED,--
517,Is rocuronium as effective as succinylcholine for intubation during emergencies?,NOT ENOUGH INFORMATION,--
518,Is lithium an effective treatment for schizophrenia when used alone or with antipsychotics?,SUPPORTED,--
519,Do different doses of prophylactic platelet transfusions affect bleeding risk in patients undergoing chemotherapy?,REFUTED,SUPPORTED
520,Does prophylactic systemic antifungal therapy reduce mortality and morbidity in very preterm or very low birth weight infants?,SUPPORTED,NOT ENOUGH INFORMATION
521,Do intra-articular corticosteroids provide significant benefits for knee osteoarthritis compared to no treatment?,NOT ENOUGH INFORMATION,--
522,Is intermittent iron supplementation during pregnancy as effective as daily supplementation for maternal and infant outcomes?,NOT ENOUGH INFORMATION,--
523,Do interventions help relieve symptoms of varicose veins and leg oedema during pregnancy?,SUPPORTED,NOT ENOUGH INFORMATION
524,Is there a beneficial effect of the intervention on patient outcomes?,NOT ENOUGH INFORMATION,--
525,Is the lactational amenorrhoea method effective as a contraceptive for fully breastfeeding women?,REFUTED,--
526,Is there a beneficial effect of the treatment on patient outcomes?,SUPPORTED,--
527,Is there a clear optimal red blood cell transfusion strategy for patients with myelodysplasia and related disorders?,SUPPORTED,--
528,Can exercise help reduce low-back and pelvic pain during pregnancy?,REFUTED,--
529,Is a therapeutic-only platelet transfusion policy as effective and safe as a prophylactic platelet transfusion policy in preventing bleeding?,SUPPORTED,NOT ENOUGH INFORMATION
530,Is there a beneficial effect of the intervention on patient outcomes?,NOT ENOUGH INFORMATION,--
531,Is there a beneficial effect of the intervention on patient outcomes?,REFUTED,--
532,Do rehabilitation interventions improve recovery in adults with distal radial fractures?,SUPPORTED,--
533,Is rivastigmine effective and safe for treating Alzheimer's disease?,SUPPORTED,--
534,Is interactive telemedicine effective as an alternative to usual care?,SUPPORTED,--
535,Does electromagnetic therapy help heal pressure ulcers?,SUPPORTED,--
536,Does antenatal anti-D immunoglobulin reduce the risk of Rhesus D alloimmunisation in Rh-negative women?,NOT ENOUGH INFORMATION,REFUTED
537,Do beta2-agonists improve symptoms of acute bronchitis in people without underlying lung disease?,SUPPORTED,--
538,Do pressure-relieving support surfaces help reduce the incidence of pressure ulcers?,NOT ENOUGH INFORMATION,REFUTED
539,Is massage therapy effective for treating non-specific low-back pain?,SUPPORTED,NOT ENOUGH INFORMATION
540,Is animal derived surfactant more effective than protein free synthetic surfactant for treating respiratory distress syndrome in preterm infants?,SUPPORTED,--
541,Is there a beneficial effect of the intervention on patient outcomes?,SUPPORTED,--
542,Is there a beneficial effect of the intervention on patient outcomes?,NOT ENOUGH INFORMATION,SUPPORTED
543,Is vaccination effective in reducing infections caused by Pseudomonas aeruginosa in cystic fibrosis?,NOT ENOUGH INFORMATION,--
544,Is transcranial magnetic stimulation effective in reducing psychotic symptoms in schizophrenia?,NOT ENOUGH INFORMATION,--
545,Does prolonged antibiotic therapy provide benefits for patients with bronchiectasis?,REFUTED,--
546,Does the extent of lymphadenectomy improve survival in patients with resectable gastric carcinoma?,SUPPORTED,--
547,Is there an effective treatment for idiopathic intracranial hypertension?,SUPPORTED,--
548,Do financial incentives for prescribers improve healthcare outcomes and reduce costs?,NOT ENOUGH INFORMATION,REFUTED
549,Is there a beneficial effect of the intervention on patient outcomes?,NOT ENOUGH INFORMATION,--
550,Are NSAIDs effective for treating primary dysmenorrhoea?,REFUTED,--
551,Does starting external cephalic version before 37 weeks help reduce breech presentations at birth?,SUPPORTED,NOT ENOUGH INFORMATION
552,Do educational interventions for postpartum women improve contraceptive use?,SUPPORTED,--
553,Do specific psychological therapies improve outcomes for adults with anorexia nervosa in outpatient settings?,REFUTED,--
554,Does expedited vaginal delivery improve perinatal outcomes in breech births?,REFUTED,SUPPORTED
555,Does planned caesarean section improve outcomes for babies in breech presentation at term?,SUPPORTED,--
556,Do reduced antenatal care visits for low-risk women lead to better outcomes compared to standard care?,SUPPORTED,REFUTED
557,Is early discharge of stable preterm infants with home support of gavage feeding beneficial compared to discharge when they have full sucking feeds?,NOT ENOUGH INFORMATION,--
558,Does diclofenac provide effective pain relief for moderate to severe postoperative pain?,REFUTED,SUPPORTED
559,Are psychosocial interventions effective for helping patients with coronary heart disease quit smoking?,SUPPORTED,NOT ENOUGH INFORMATION
560,Does electromagnetic therapy help heal venous leg ulcers?,SUPPORTED,NOT ENOUGH INFORMATION
561,Does routine late pregnancy ultrasound improve outcomes for mothers and babies in low-risk pregnancies?,REFUTED,--
562,Does immediate insertion of intrauterine contraception after delivery improve successful placement compared to later insertion?,SUPPORTED,--
563,Can chelation therapy improve symptoms of autism spectrum disorder?,SUPPORTED,REFUTED
564,Are medical day hospitals effective in improving health outcomes for older people?,SUPPORTED,--
565,Do prophylactic antibiotics improve maternal and perinatal outcomes during pregnancy?,NOT ENOUGH INFORMATION,--
566,Is there a beneficial effect of the intervention on patient outcomes?,NOT ENOUGH INFORMATION,REFUTED
567,Is fluoride gel effective in preventing dental caries in children and adolescents?,SUPPORTED,--
568,Do social skills training programmes improve outcomes for people with schizophrenia compared to standard care?,REFUTED,--
569,Is there a beneficial effect of the intervention on patient outcomes?,NOT ENOUGH INFORMATION,--
570,Does regional anaesthesia reduce the risk of postoperative apnoea in preterm infants undergoing surgery?,SUPPORTED,--
571,Do taxane-containing chemotherapy regimens improve outcomes for women with metastatic breast cancer compared to non-taxane regimens?,SUPPORTED,NOT ENOUGH INFORMATION
572,Does vitamin B6 supplementation during pregnancy provide clinical benefits?,NOT ENOUGH INFORMATION,--
573,Are pharmacological interventions effective in reducing drug use or criminal activity among drug-using offenders?,REFUTED,NOT ENOUGH INFORMATION
574,Does antenatal nutritional education improve maternal and infant health outcomes?,SUPPORTED,--
575,Does Directly Observed Therapy improve adherence to tuberculosis treatment compared to self-administered therapy?,SUPPORTED,--
576,Do anti-inflammatory agents help prevent further heart damage in patients with acute rheumatic fever?,SUPPORTED,--
577,Do dopamine agonists effectively treat cocaine misuse?,REFUTED,--
578,Do oral protein calorie supplements improve nutritional status in children with chronic diseases?,SUPPORTED,--
579,Does convective dialysis improve clinical outcomes compared to diffusive dialysis in patients with end-stage kidney disease?,REFUTED,SUPPORTED
580,Does preoperative chemotherapy improve survival in patients with resectable thoracic esophageal cancer?,SUPPORTED,REFUTED
581,Do cap and co-payment policies affect the use of medicines and healthcare costs?,REFUTED,--
582,Do psychological interventions help people with sickle cell disease cope better with their condition?,SUPPORTED,NOT ENOUGH INFORMATION
583,Is there a beneficial effect of the intervention on patient outcomes?,SUPPORTED,--
584,Are tailored intervention strategies effective in improving healthcare professional practice?,SUPPORTED,--
585,Is it safer to wait for a specific period before discontinuing antiepileptic drugs in patients with epilepsy?,NOT ENOUGH INFORMATION,--
586,Is the combination of clindamycin and gentamicin effective for treating postpartum endometritis?,SUPPORTED,NOT ENOUGH INFORMATION
587,Does feverfew help in preventing migraine attacks compared to a placebo?,REFUTED,--
588,Are antiviral agents more effective than other treatments for herpes simplex virus eye disease?,SUPPORTED,--
589,Does routine Doppler ultrasound improve outcomes for low-risk pregnancies?,SUPPORTED,--
590,Is balneotherapy effective for managing symptoms of rheumatoid arthritis?,NOT ENOUGH INFORMATION,--
591,Is there a beneficial effect of the intervention on patient outcomes?,SUPPORTED,--
592,Do adjunctive corticosteroids reduce mortality and the need for mechanical ventilation in HIV-infected patients with PCP and substantial hypoxaemia?,SUPPORTED,--
593,Does external cephalic version at term improve pregnancy outcomes?,SUPPORTED,--
594,Is there a beneficial effect of the treatment on patient outcomes?,SUPPORTED,--
595,Do hormonal contraceptives affect lactation and infant growth?,REFUTED,SUPPORTED
596,Does high frequency oscillatory ventilation reduce the risk of chronic lung disease in preterm infants compared to conventional ventilation?,SUPPORTED,NOT ENOUGH INFORMATION
597,Is optic nerve decompression surgery effective for treating nonarteritic anterior ischemic optic neuropathy?,SUPPORTED,NOT ENOUGH INFORMATION
598,Is there a beneficial effect of the intervention on patient outcomes?,NOT ENOUGH INFORMATION,SUPPORTED
599,Is there a beneficial effect of the intervention on patient outcomes?,REFUTED,--
600,Do immunosuppressive agents improve outcomes in multifocal motor neuropathy?,NOT ENOUGH INFORMATION,REFUTED
601,Does pulmonary rehabilitation improve health-related quality of life and exercise capacity in COPD patients?,NOT ENOUGH INFORMATION,--
602,Do antiplatelet agents improve the success of bypass grafting in patients with lower limb atherosclerosis?,SUPPORTED,--
603,Do pharmacological interventions reduce sexual offending behavior in convicted individuals?,REFUTED,--
604,Is a two-step alcohol skin cleansing procedure before blood donation more effective than a one-step procedure in preventing blood contamination?,REFUTED,SUPPORTED
605,Do certain interventions improve the success of turning a breech baby to head first presentation?,REFUTED,SUPPORTED
606,Are fluphenazine decanoate and enanthate more effective than oral antipsychotics for treating schizophrenia?,SUPPORTED,NOT ENOUGH INFORMATION
607,Is homeopathic Oscillococcinum® more effective than placebo for preventing or treating influenza?,REFUTED,--
608,Is there a beneficial effect of the intervention on patient outcomes?,SUPPORTED,--
609,Is conservative management effective for urinary incontinence after prostate surgery?,NOT ENOUGH INFORMATION,--
610,Can palliative radiotherapy improve symptoms in patients with advanced lung cancer?,SUPPORTED,NOT ENOUGH INFORMATION
611,Does intravenous metoclopramide help with the placement of naso-enteral tubes in adults?,NOT ENOUGH INFORMATION,--
612,Is minimally invasive surgery effective for treating solid tumors in children?,SUPPORTED,--
613,Does reducing dietary salt intake have a significant impact on mortality and cardiovascular health?,NOT ENOUGH INFORMATION,--
614,Does patient education help prevent foot ulcers in people with diabetes?,SUPPORTED,REFUTED
615,Does surfactant administration help treat meconium aspiration syndrome in infants?,NOT ENOUGH INFORMATION,SUPPORTED
616,Does nocturnal mechanical ventilation improve survival in patients with neuromuscular or chest wall disorders?,SUPPORTED,--
617,"Is there a difference in effectiveness between open surgery, endolaryngeal excision, and radiotherapy for early glottic laryngeal cancer?",SUPPORTED,--
618,Does cinacalcet provide overall benefits for adults with chronic kidney disease?,SUPPORTED,--
619,Is the Epley manoeuvre an effective treatment for posterior canal BPPV?,NOT ENOUGH INFORMATION,--
620,Is balloon angioplasty with stenting more effective than medical therapy for treating hypertension in patients with renal artery stenosis?,SUPPORTED,--
621,Does careful restriction of water intake in premature infants help reduce the risk of serious health issues?,NOT ENOUGH INFORMATION,SUPPORTED
622,Are over-the-counter cough medicines effective for treating acute cough in children and adults?,SUPPORTED,--
623,Do interventions aimed at improving medication adherence lead to better clinical outcomes?,REFUTED,--
624,Does tonsillectomy help reduce the frequency and severity of sore throat episodes in children and adults with chronic tonsillitis?,SUPPORTED,--
625,Is there a beneficial effect of the intervention on patient outcomes?,NOT ENOUGH INFORMATION,--
626,Is there a beneficial effect of the intervention on patient outcomes?,REFUTED,SUPPORTED
627,Does adding colony-stimulating factors to antibiotics improve outcomes for patients with chemotherapy-induced febrile neutropenia?,SUPPORTED,--
628,Should blood pressure be actively lowered during the acute phase of stroke?,SUPPORTED,REFUTED
629,Do antibiotics help improve outcomes for mothers and babies with prelabour rupture of membranes at term?,REFUTED,SUPPORTED
630,Do immunotherapies improve live birth rates in women with unexplained recurrent miscarriages?,SUPPORTED,--
631,Does acupuncture have antipsychotic effects for people with schizophrenia?,REFUTED,--
632,Do pharmaceutical pricing and purchasing policies affect health outcomes and drug use?,SUPPORTED,--
633,Is there a beneficial effect of the treatment on patient outcomes?,REFUTED,SUPPORTED
634,Does malaria chemoprevention improve health outcomes for pregnant women and their infants in malaria endemic areas?,REFUTED,--
635,Are interventions effective in reducing the severity of cough in whooping cough?,SUPPORTED,NOT ENOUGH INFORMATION
636,Does intravenous immunoglobulin (IVIg) help speed up recovery in Guillain-Barré syndrome?,REFUTED,--
637,Are acellular pertussis vaccines effective and safer than whole-cell vaccines for children?,NOT ENOUGH INFORMATION,--
638,Are antidepressants effective for treating postnatal depression compared to other treatments?,NOT ENOUGH INFORMATION,--
639,Does wearing compression hosiery help prevent the recurrence of venous ulcers?,NOT ENOUGH INFORMATION,REFUTED
640,Does oral zinc help heal arterial or venous leg ulcers?,REFUTED,--
641,Is treating asymptomatic retinal breaks and lattice degeneration effective in preventing retinal detachment?,SUPPORTED,--
642,Does nystatin reduce morbidity and mortality in patients with severe immunodeficiency?,SUPPORTED,--
643,Is amphotericin B more effective than fluconazole in reducing morbidity and mortality in cancer patients with neutropenia?,SUPPORTED,REFUTED
644,Do antifungal drugs reduce mortality in cancer patients with neutropenia?,NOT ENOUGH INFORMATION,REFUTED
645,Are lipid soluble formulations of amphotericin B more beneficial than conventional amphotericin B for cancer patients with neutropenia?,SUPPORTED,--
646,Is multidisciplinary biopsychosocial rehabilitation effective for patients with chronic low back pain?,SUPPORTED,--
647,Do corticosteroids help in treating acute exacerbations of COPD?,SUPPORTED,--
648,Does haemodilution therapy improve outcomes in acute ischaemic stroke?,NOT ENOUGH INFORMATION,--
649,Does advanced life support training for ambulance crews improve outcomes for trauma patients?,SUPPORTED,REFUTED
650,Is oral budesonide effective for maintaining remission in Crohn's disease?,SUPPORTED,--
651,Is there a beneficial effect of the intervention on patient outcomes?,NOT ENOUGH INFORMATION,--
652,Is there a beneficial effect of the intervention on patient outcomes?,SUPPORTED,--
