,Question,Newest Label,Outdated Label
878,Is intravenous immunoglobulin effective for treating myasthenia gravis exacerbations?,NOT ENOUGH INFORMATION,--
879,Do drugs other than desmopressin and tricyclics effectively treat bedwetting in children?,SUPPORTED,--
880,Are different interventions effective for treating vaginismus?,SUPPORTED,REFUTED
881,Is pentoxifylline effective for treating venous leg ulcers?,SUPPORTED,--
882,Does nutritional support improve health outcomes in patients with COPD?,SUPPORTED,--
883,Does ursodeoxycholic acid provide significant benefits for patients with primary biliary cirrhosis?,NOT ENOUGH INFORMATION,SUPPORTED
884,Does maternal oxygen administration improve outcomes for fetuses in distress during labor?,SUPPORTED,--
885,Do barbiturates improve outcomes in patients with acute traumatic brain injury?,SUPPORTED,--
886,Are benzodiazepines effective for treating schizophrenia and schizophrenia-like psychoses?,SUPPORTED,--
887,Do different skin closure techniques after caesarean section affect maternal outcomes?,REFUTED,NOT ENOUGH INFORMATION
888,Is oral horse chestnut seed extract effective and safe for treating chronic venous insufficiency?,NOT ENOUGH INFORMATION,--
889,Do macrolide antibiotics improve clinical status in people with cystic fibrosis?,SUPPORTED,REFUTED
890,Does rhIGF-I treatment have a positive effect on disease progression in ALS?,SUPPORTED,NOT ENOUGH INFORMATION
891,Is depot bromperidol more effective than placebo for treating schizophrenia?,SUPPORTED,NOT ENOUGH INFORMATION
892,Does early surfactant therapy improve outcomes for newborns with respiratory distress?,REFUTED,NOT ENOUGH INFORMATION
893,Do topical agents or dressings help relieve pain in venous leg ulcers?,SUPPORTED,--
894,Are antibiotics effective for treating non-typhoidal Salmonella diarrhoea in healthy individuals?,REFUTED,NOT ENOUGH INFORMATION
895,Do continuous suturing techniques for perineal repair result in less pain compared to interrupted methods?,NOT ENOUGH INFORMATION,--
896,Does compression therapy help heal venous ulcers?,SUPPORTED,--
897,Do topical preparations effectively prevent stretch marks during pregnancy?,SUPPORTED,--
898,Are oral treatments effective for fungal infections of the skin of the foot?,NOT ENOUGH INFORMATION,--
899,Is the combined spinal-epidural technique better than traditional epidural analgesia during labor?,SUPPORTED,--
900,Is methenamine hippurate effective in preventing urinary tract infections in patients without renal tract abnormalities?,NOT ENOUGH INFORMATION,REFUTED
901,Can oestrogen treatment improve urinary incontinence in women?,SUPPORTED,--
902,Are exogenous steroid sex hormones effective in treating lower limb atherosclerosis?,SUPPORTED,--
903,Can postural management improve outcomes for babies in breech presentation?,SUPPORTED,--
904,Is the combination of inhaled steroids and long-acting beta-agonists more effective than long-acting beta-agonists alone for managing COPD?,SUPPORTED,--
905,Does antenatal maternal glucose administration improve fetal wellbeing tests?,SUPPORTED,--
906,Do air ionisers help reduce asthma symptoms?,REFUTED,NOT ENOUGH INFORMATION
907,Is screening for hepatocellular carcinoma in patients with chronic hepatitis B virus infection beneficial?,SUPPORTED,--
908,Do treatments to reduce fever in malaria affect the course of the illness?,SUPPORTED,NOT ENOUGH INFORMATION
909,Are progestogens effective in regulating irregular menstrual bleeding associated with anovulation?,SUPPORTED,--
910,Are local treatments effective for treating viral warts in healthy individuals?,SUPPORTED,--
911,Are vitamin K antagonists more effective than antiplatelet therapy for preventing vascular events after a TIA or minor stroke?,SUPPORTED,--
912,Can the Alexander technique help improve symptoms in people with chronic asthma?,SUPPORTED,NOT ENOUGH INFORMATION
913,Does piracetam have a beneficial effect on outcomes in acute ischaemic stroke?,SUPPORTED,--
914,Is there a beneficial effect of the intervention on patient outcomes?,SUPPORTED,--
915,Is silver acetate effective in helping people quit smoking?,REFUTED,--
916,Does prophylactic amnioinfusion provide benefits over therapeutic amnioinfusion in labor with oligohydramnios?,REFUTED,--
917,Does an antigen avoidance diet during pregnancy or lactation help prevent atopic diseases in children?,REFUTED,--
918,Do psychological interventions have beneficial effects for borderline personality disorder?,SUPPORTED,REFUTED
919,Does exclusive breastfeeding for six months improve child health compared to shorter durations?,REFUTED,NOT ENOUGH INFORMATION
920,Are novel speech therapy techniques more effective than standard techniques for treating speech problems in Parkinson's disease?,NOT ENOUGH INFORMATION,--
921,Is speech and language therapy effective for improving speech problems in Parkinson's disease?,SUPPORTED,NOT ENOUGH INFORMATION
922,Does ivermectin help prevent visual impairment in onchocerciasis?,SUPPORTED,--
923,Is minocycline an effective treatment for acne vulgaris?,NOT ENOUGH INFORMATION,--
924,Is prophylactic use of prostaglandins effective in managing the third stage of labour?,SUPPORTED,NOT ENOUGH INFORMATION
925,Does hormone therapy with both estrogen and progestogen effectively protect against endometrial hyperplasia?,SUPPORTED,NOT ENOUGH INFORMATION
926,Do biochemical tests of placental function improve outcomes in high-risk pregnancies?,SUPPORTED,REFUTED
927,Does care in an alternative birth environment lead to fewer medical interventions compared to a conventional setting?,SUPPORTED,--
928,Does using regular intravenous antibiotics improve survival rates in cystic fibrosis patients?,REFUTED,--
929,Do biofeedback and anal sphincter exercises improve faecal incontinence in adults?,REFUTED,NOT ENOUGH INFORMATION
930,Is intravenous naftidrofuryl effective in treating critical limb ischaemia?,SUPPORTED,--
931,Do opioids effectively relieve breathlessness in patients receiving palliative care?,SUPPORTED,REFUTED
932,Is there a difference in effectiveness or safety between different colloid solutions for volume replacement?,SUPPORTED,--
933,Is surgery more effective than non-surgical treatments for vocal cord nodules?,REFUTED,--
934,Does operative management for fetal distress improve outcomes for mothers and babies compared to conservative management?,SUPPORTED,--
935,Does piracetam help improve outcomes for fetal distress during labor?,REFUTED,--
936,Does prophylactic abdominal decompression improve pregnancy outcomes?,SUPPORTED,--
937,Is there a clear best treatment for isolated fractures of the ulnar shaft in adults?,SUPPORTED,NOT ENOUGH INFORMATION
938,Does audit and feedback improve healthcare professionals' practice and patient outcomes?,SUPPORTED,--
939,Are prophylactic anti-epileptic agents effective in preventing early seizures after a traumatic head injury?,SUPPORTED,--
940,Does antenatal abdominal decompression improve perinatal outcomes for women with hypertension or impaired fetal growth?,SUPPORTED,--
941,Are totally implantable venous access devices safe and effective for administering intravenous antibiotics in people with cystic fibrosis?,REFUTED,NOT ENOUGH INFORMATION
942,Is treating acute exacerbations of COPD at home effective compared to hospital inpatient care?,REFUTED,SUPPORTED
943,Are inhaled corticosteroids more effective than anti-leukotrienes for treating asthma?,REFUTED,--
944,Does modifying dietary fats reduce cardiovascular risk?,SUPPORTED,--
945,Do high intensity interventions during hospital stays help patients quit smoking?,SUPPORTED,--
946,Does training health professionals improve their effectiveness in helping patients quit smoking?,SUPPORTED,--
947,Are primary care based asthma clinics effective in managing asthma?,SUPPORTED,NOT ENOUGH INFORMATION
948,Do angiotensin receptor blockers improve survival or health outcomes in patients with heart failure?,SUPPORTED,--
949,Do neuraminidase inhibitors effectively treat and prevent influenza in children?,NOT ENOUGH INFORMATION,--
950,Is single dose oral aspirin effective for managing acute postoperative pain?,NOT ENOUGH INFORMATION,--
951,Are surgical interventions more effective than non-surgical interventions for treating ingrowing toenails?,SUPPORTED,--
952,Do outreach respiratory health care worker programmes improve the quality of life for COPD patients?,SUPPORTED,--
953,Is zuclopenthixol acetate effective for managing acute aggression in psychiatric patients compared to other treatments?,SUPPORTED,--
954,Do antioxidant supplements help prevent mortality in adults?,SUPPORTED,--
955,Are progestagens and anti-progestagens effective in treating pain from endometriosis?,NOT ENOUGH INFORMATION,--
956,Does riluzole prolong survival in patients with amyotrophic lateral sclerosis?,SUPPORTED,NOT ENOUGH INFORMATION
957,Is prophylactic surfactant administration more effective than treatment of established RDS in very preterm infants?,SUPPORTED,--
958,Do fibrinogen depleting agents help treat acute ischaemic stroke?,SUPPORTED,--
959,Are flapless dental implant procedures beneficial for patients?,SUPPORTED,REFUTED
960,Do antipsychotic drugs have effects on elderly people with late-onset schizophrenia?,NOT ENOUGH INFORMATION,SUPPORTED
961,Are medical therapies for anal fissure more effective than surgery?,NOT ENOUGH INFORMATION,--
962,Is there a better surgical method for improving or replacing bladder function using intestinal segments?,NOT ENOUGH INFORMATION,SUPPORTED
963,Does rhGH treatment improve height in children with chronic kidney disease?,NOT ENOUGH INFORMATION,--
964,Is the stapled technique more effective than the handsewn technique in colorectal anastomosis surgery?,SUPPORTED,--
965,Does quitting smoking significantly reduce the risk of death for patients with coronary heart disease?,SUPPORTED,--
966,Is oral sumatriptan effective for treating acute migraine attacks in adults?,NOT ENOUGH INFORMATION,--
967,Do organisational infrastructures effectively promote evidence-based nursing?,REFUTED,NOT ENOUGH INFORMATION
968,Can lobeline help people quit smoking in the long term?,NOT ENOUGH INFORMATION,--
969,Do different anticholinergic drugs have varying effects on overactive bladder symptoms?,SUPPORTED,--
970,Are there effective treatments for peri-implantitis around dental implants?,NOT ENOUGH INFORMATION,--
971,Is decompressive surgery effective in improving survival for patients with massive acute ischaemic stroke and cerebral oedema?,REFUTED,--
972,Do certain antibiotic regimens effectively reduce infections after cesarean sections?,SUPPORTED,NOT ENOUGH INFORMATION
973,Is high-dose steroid treatment effective for reducing paralysis after acute spinal cord injury?,SUPPORTED,--
974,Do hospital-at-home services for acute stroke patients provide better outcomes than conventional hospital care?,SUPPORTED,--
975,Are life skills programmes effective for improving outcomes in people with chronic mental health problems?,SUPPORTED,NOT ENOUGH INFORMATION
976,Does amnioinfusion improve outcomes for mothers and babies during labor?,SUPPORTED,--
977,Do complementary interventions have an effect on bedwetting in children?,REFUTED,NOT ENOUGH INFORMATION
978,Is day hospital care as effective as inpatient care for acute psychiatric disorders?,NOT ENOUGH INFORMATION,SUPPORTED
979,Is prescribing heroin to opioid-dependent individuals more effective than traditional treatments like methadone?,REFUTED,NOT ENOUGH INFORMATION
980,Does suctioning without disconnection from the ventilator improve outcomes in intubated neonates?,SUPPORTED,--
981,Do antidepressants effectively treat cocaine dependence?,SUPPORTED,--
982,Do behavioural interventions improve faecal incontinence in children?,NOT ENOUGH INFORMATION,SUPPORTED
983,Is there a superior method for treating involutional entropion?,NOT ENOUGH INFORMATION,--
984,Is diuretic administration beneficial for preterm infants with respiratory distress syndrome?,SUPPORTED,--
985,Does applying traction to a hip fracture before surgery provide any benefits?,SUPPORTED,--
986,Is caesarean birth for a second twin in breech position better than vaginal birth?,SUPPORTED,--
987,Is oral immunoglobulin effective in preventing rotavirus infection in low birthweight infants?,NOT ENOUGH INFORMATION,SUPPORTED
988,Is there a best surgical technique for treating chronic anal fissures?,NOT ENOUGH INFORMATION,SUPPORTED
989,Does teaching critical appraisal skills to health professionals improve patient outcomes and care processes?,SUPPORTED,--
990,Does administering human albumin reduce mortality in critically ill patients?,REFUTED,--
991,Do granulocyte transfusions improve survival in neutropenic septic neonates?,NOT ENOUGH INFORMATION,--
992,Is oral immunoglobulin effective and safe for treating rotavirus diarrhea in low birth weight infants?,SUPPORTED,--
993,Does tobacco advertising increase the likelihood that nonsmoking adolescents will start smoking?,REFUTED,--
994,Does treating iron deficiency anaemia in pregnancy improve outcomes for mothers and babies?,NOT ENOUGH INFORMATION,--
995,Is venepuncture less painful than heel lance for blood sampling in term neonates?,SUPPORTED,--
996,Are psychosocial interventions effective in improving outcomes for opioid detoxification when combined with pharmacological treatments?,NOT ENOUGH INFORMATION,SUPPORTED
997,Does terazosin improve urinary symptoms in men with benign prostatic obstruction?,NOT ENOUGH INFORMATION,--
998,Are psychosocial and educational interventions effective in preventing alcohol misuse among young people?,SUPPORTED,NOT ENOUGH INFORMATION
999,Does tamsulosin improve urinary symptoms in men with benign prostatic hyperplasia?,NOT ENOUGH INFORMATION,--
1000,Do distal diuretics improve lung function in preterm infants with chronic lung disease?,NOT ENOUGH INFORMATION,--
1001,Is mechanical bowel preparation effective in reducing complications during colorectal surgery?,NOT ENOUGH INFORMATION,--
1002,Do loop diuretics provide benefits for preterm infants with chronic lung disease?,REFUTED,--
1003,Is counselling effective for patients with mental health problems in primary care?,SUPPORTED,--
1004,Can corticosteroids improve outcomes in acute ischaemic stroke?,SUPPORTED,--
1005,Does a single dose of dexamethasone reduce complications after tonsillectomy?,SUPPORTED,NOT ENOUGH INFORMATION
1006,Does cot-nursing provide similar benefits to incubator care for preterm infants?,NOT ENOUGH INFORMATION,SUPPORTED
1007,Is anticoagulant therapy effective and safe for treating cerebral venous sinus thrombosis?,SUPPORTED,REFUTED
1008,Is there an effective treatment for Achilles tendinitis?,SUPPORTED,NOT ENOUGH INFORMATION
1009,Do antiretroviral regimens effectively reduce the risk of mother-to-child transmission of HIV?,NOT ENOUGH INFORMATION,SUPPORTED
1010,Do integration strategies for primary health care services improve healthcare delivery and health status in low- and middle-income countries?,NOT ENOUGH INFORMATION,--
1011,Is deep suctioning of endotracheal tubes more effective than shallow suctioning in ventilated infants?,NOT ENOUGH INFORMATION,--
1012,Does providing a written asthma self-management plan improve treatment adherence and outcomes?,SUPPORTED,NOT ENOUGH INFORMATION
1013,Are community-based interventions effective in preventing young people from starting to smoke?,REFUTED,NOT ENOUGH INFORMATION
1014,Do interventions help prevent lower limb soft-tissue injuries in runners?,SUPPORTED,NOT ENOUGH INFORMATION
1015,Can exercise help prevent bone loss in postmenopausal women?,REFUTED,--
1016,Is bronchial hygiene physical therapy effective for patients with chronic obstructive pulmonary disease and bronchiectasis?,NOT ENOUGH INFORMATION,--
1017,Can early intervention improve outcomes for people with early symptoms of schizophrenia?,SUPPORTED,--
1018,Do psychoeducational interventions improve outcomes for patients with schizophrenia compared to standard knowledge provision?,SUPPORTED,--
1019,Does propylthiouracil have beneficial effects for patients with alcoholic liver disease?,REFUTED,NOT ENOUGH INFORMATION
1020,Does platinum-based chemotherapy improve survival in patients with locally advanced bladder cancer?,SUPPORTED,NOT ENOUGH INFORMATION
1021,Does ultrasound therapy help in the treatment of acute ankle sprains?,SUPPORTED,--
1022,Is adjuvant progestagen therapy effective for treating endometrial cancer?,SUPPORTED,--
1023,Does antithrombotic treatment improve outcomes for patients with chronic PAD after bypass surgery?,SUPPORTED,--
1024,Do different generations of progestogens in combined oral contraceptives affect continuation rates and side effects?,SUPPORTED,--
1025,Is a shorter infusion of paclitaxel as effective as a longer infusion for treating advanced adenocarcinoma?,REFUTED,--
1026,Is primary radiotherapy to the groin as effective and safe as surgery for early vulvar cancer?,REFUTED,NOT ENOUGH INFORMATION
1027,Do steroids help improve hearing loss in children with otitis media with effusion?,SUPPORTED,REFUTED
1028,Does Cernilton improve urinary symptoms in men with benign prostatic hyperplasia?,SUPPORTED,--
1029,Does treating trichomoniasis during pregnancy improve pregnancy outcomes?,SUPPORTED,--
1030,Do ankle supports help prevent sprains in active individuals?,REFUTED,--
1031,Does hyperbaric oxygen therapy help prevent neurological problems in carbon monoxide poisoning?,REFUTED,--
1032,Does naltrexone maintenance treatment effectively prevent relapse in opioid addicts after detoxification?,SUPPORTED,REFUTED
1033,Is Assertive Community Treatment effective in managing care for severely mentally ill individuals?,SUPPORTED,--
1034,Does increased folate consumption reduce the risk of neural tube defects?,SUPPORTED,NOT ENOUGH INFORMATION
1035,Do behavioural interventions for young women effectively promote safer sexual behaviours to prevent STIs and cervical cancer?,NOT ENOUGH INFORMATION,REFUTED
1036,Are prophylactic agents effective in preventing oral mucositis in cancer patients undergoing treatment?,NOT ENOUGH INFORMATION,--
1037,Is cognitive behavioural therapy more effective than other psychological therapies for people with schizophrenia?,NOT ENOUGH INFORMATION,SUPPORTED
1038,Does case management improve the care of severely mentally ill people in the community?,NOT ENOUGH INFORMATION,--
1039,Do chemotherapy wafers improve survival for patients with high grade glioma?,SUPPORTED,--
1040,Is gabapentin effective for managing neuropathic pain?,NOT ENOUGH INFORMATION,REFUTED
1041,Is platelet-rich plasmapheresis effective in reducing the need for blood transfusions during surgery?,SUPPORTED,--
1042,Is surgery beneficial and safe for treating lateral elbow pain?,SUPPORTED,--
1043,Do parenting programmes improve outcomes for teenage parents and their children?,NOT ENOUGH INFORMATION,REFUTED
1044,Is one technique of tonsillectomy better than the other in terms of morbidity?,NOT ENOUGH INFORMATION,REFUTED
1045,Do anti-fibrinolytic drugs reduce blood loss and the need for blood transfusion during surgery?,SUPPORTED,NOT ENOUGH INFORMATION
1046,Is decongestant and antihistamine therapy effective for treating acute otitis media in children?,NOT ENOUGH INFORMATION,--
1047,Do population-based biomedical STI interventions reduce the incidence of HIV infection?,SUPPORTED,--
1048,Does reducing dietary sodium improve asthma control?,NOT ENOUGH INFORMATION,REFUTED
1049,Are oximes effective and safe for treating acute organophosphorus pesticide poisoning?,REFUTED,--
1050,Is there a significant difference in effectiveness between hMG and rFSH for ovarian stimulation in IVF treatments?,NOT ENOUGH INFORMATION,--
1051,Do modifications to the home environment help reduce injuries caused by environmental hazards?,REFUTED,--
1052,Is treatment effective for improving muscle strength in Lambert-Eaton myasthenic syndrome?,SUPPORTED,--
1053,Do herbal medicines provide benefits in treating rheumatoid arthritis?,SUPPORTED,--
1054,Are psychological interventions effective in improving symptoms and quality of life in patients with non-ulcer dyspepsia?,REFUTED,--
1055,Does eradicating H pylori improve symptoms in patients with non-ulcer dyspepsia?,NOT ENOUGH INFORMATION,--
1056,Are anti-secretory drugs effective in improving symptoms of non-ulcer dyspepsia?,REFUTED,NOT ENOUGH INFORMATION
1057,Does vitamin D supplementation improve pregnancy outcomes?,SUPPORTED,--
1058,Does iliac crest autograft provide better outcomes than other techniques for cervical spine fusion?,NOT ENOUGH INFORMATION,--
1059,Do bile acids have beneficial effects for patients with primary sclerosing cholangitis?,NOT ENOUGH INFORMATION,--
1060,Is there a specific antibiotic regimen that is most effective for treating urinary tract infections during pregnancy?,SUPPORTED,--
1061,Do multiple risk factor interventions effectively reduce mortality and events from coronary heart disease in adults without prior clinical evidence of the disease?,SUPPORTED,--
1062,Does digoxin treatment reduce mortality in premature infants with respiratory distress syndrome?,SUPPORTED,--
1063,Is sublingual immunotherapy effective and safe for treating allergic rhinitis?,SUPPORTED,--
1064,Are opioid antagonists effective in treating alcohol dependence?,SUPPORTED,--
1065,Does prophylactic treatment with methylxanthine reduce apnoea in preterm infants?,NOT ENOUGH INFORMATION,--
1066,Does methylxanthine treatment reduce apnoea in preterm infants?,SUPPORTED,--
1067,Does prophylactic methylxanthine treatment improve the chances of successful extubation in preterm infants?,SUPPORTED,--
1068,Does magnesium sulphate reduce the risk of seizures and maternal death in women with eclampsia compared to diazepam?,NOT ENOUGH INFORMATION,REFUTED
1069,Do family psychosocial interventions help reduce relapses in people with schizophrenia?,SUPPORTED,NOT ENOUGH INFORMATION
1070,Can vitamin A supplementation during pregnancy improve maternal and newborn health outcomes?,NOT ENOUGH INFORMATION,--
1071,Are soft vacuum extractor cups less effective than rigid cups for difficult deliveries?,SUPPORTED,--
1072,Does using a vacuum extractor for assisted delivery reduce maternal morbidity compared to forceps?,SUPPORTED,--
1073,Is aspirin effective for relieving itching in late pregnancy without a rash?,NOT ENOUGH INFORMATION,--
1074,Does magnesium sulphate effectively prevent eclampsia?,SUPPORTED,--
1075,Is autologous chondrocyte implantation effective and safe for treating knee cartilage defects?,NOT ENOUGH INFORMATION,REFUTED
1076,Can an oral vaccine for H. influenzae help reduce recurrent episodes in chronic bronchitis?,REFUTED,--
1077,Is vaginal misoprostol effective for cervical ripening or induction of labour?,NOT ENOUGH INFORMATION,--
1078,Is there a better functional outcome for patients with eICAD when treated with anticoagulants or antiplatelet agents compared to control?,NOT ENOUGH INFORMATION,--
1079,Is magnesium sulphate more effective than phenytoin for treating eclampsia?,SUPPORTED,--
1080,Do non-steroid agents improve outcomes in adults with idiopathic pulmonary fibrosis?,SUPPORTED,NOT ENOUGH INFORMATION
1081,Is magnesium sulphate more effective than lytic cocktail for treating eclampsia?,SUPPORTED,NOT ENOUGH INFORMATION
1082,Does antibiotic prophylaxis reduce bacterial infections in cirrhotic patients with upper gastrointestinal bleeding?,SUPPORTED,REFUTED
1083,Is vacuum aspiration a safer and more effective method for managing incomplete miscarriage compared to sharp curettage?,SUPPORTED,NOT ENOUGH INFORMATION
1084,Are longer courses of antibiotics more effective than shorter courses for treating acute otitis media in children?,NOT ENOUGH INFORMATION,SUPPORTED
1085,Do treatments for nausea and vomiting in early pregnancy have beneficial effects?,REFUTED,SUPPORTED
1086,Are there effective interventions for maintaining soft tissue health around dental implants?,REFUTED,--
1087,Is there an effective treatment for oral mucositis in cancer patients undergoing chemotherapy or radiotherapy?,REFUTED,NOT ENOUGH INFORMATION
1088,Do physical methods effectively reduce the risk of DVT in patients with recent stroke?,NOT ENOUGH INFORMATION,--
1089,Is aerobic exercise safe and beneficial for adults living with HIV?,SUPPORTED,NOT ENOUGH INFORMATION
1090,Does allergen specific immunotherapy improve asthma symptoms?,SUPPORTED,--
1091,Are injected cholera vaccines effective in preventing cholera and death?,SUPPORTED,NOT ENOUGH INFORMATION
1092,Is lumiracoxib effective for managing moderate to severe postoperative pain?,NOT ENOUGH INFORMATION,--
1093,Should blood pressure be actively altered during the acute phase of stroke?,NOT ENOUGH INFORMATION,--
1094,Is behavioural therapy effective for managing chronic low-back pain?,SUPPORTED,--
1095,Is there an effective treatment for oral candidiasis in cancer patients undergoing chemotherapy or radiotherapy?,REFUTED,--
1096,Do measures to reduce house dust mite exposure help manage allergic rhinitis?,SUPPORTED,--
1097,Do outpatient pharmacists improve patient care outcomes?,NOT ENOUGH INFORMATION,--
1098,Does prophylactic indomethacin reduce mortality and morbidity in preterm infants?,NOT ENOUGH INFORMATION,REFUTED
1099,Does bed rest in hospital help prevent preterm birth in women with multiple pregnancies?,SUPPORTED,--
1100,Do drugs have beneficial effects for treating borderline personality disorder?,REFUTED,--
1101,Does cementing hip prostheses improve post-operative pain and mobility?,SUPPORTED,--
1102,Is resting in bed effective for treating acute low-back pain or sciatica?,SUPPORTED,NOT ENOUGH INFORMATION
1103,Do different suture materials affect pain and recovery after perineal repair?,SUPPORTED,--
1104,Does adding long-acting inhaled beta-agonists to inhaled corticosteroids improve asthma control in patients not well managed on corticosteroids alone?,NOT ENOUGH INFORMATION,SUPPORTED
