,Question,Newest Label,Outdated Label
520,Does prophylactic systemic antifungal therapy reduce mortality and morbidity in very preterm or very low birth weight infants?,SUPPORTED,NOT ENOUGH INFORMATION
523,Do interventions help relieve symptoms of varicose veins and leg oedema during pregnancy?,SUPPORTED,NOT ENOUGH INFORMATION
529,Is a therapeutic-only platelet transfusion policy as effective and safe as a prophylactic platelet transfusion policy in preventing bleeding?,SUPPORTED,NOT ENOUGH INFORMATION
536,Does antenatal anti-D immunoglobulin reduce the risk of Rhesus D alloimmunisation in Rh-negative women?,NOT ENOUGH INFORMATION,REFUTED
538,Do pressure-relieving support surfaces help reduce the incidence of pressure ulcers?,NOT ENOUGH INFORMATION,REFUTED
539,Is massage therapy effective for treating non-specific low-back pain?,SUPPORTED,NOT ENOUGH INFORMATION
542,Is there a beneficial effect of the intervention on patient outcomes?,NOT ENOUGH INFORMATION,SUPPORTED
548,Do financial incentives for prescribers improve healthcare outcomes and reduce costs?,NOT ENOUGH INFORMATION,REFUTED
551,Does starting external cephalic version before 37 weeks help reduce breech presentations at birth?,SUPPORTED,NOT ENOUGH INFORMATION
554,Does expedited vaginal delivery improve perinatal outcomes in breech births?,REFUTED,SUPPORTED
556,Do reduced antenatal care visits for low-risk women lead to better outcomes compared to standard care?,SUPPORTED,REFUTED
558,Does diclofenac provide effective pain relief for moderate to severe postoperative pain?,REFUTED,SUPPORTED
559,Are psychosocial interventions effective for helping patients with coronary heart disease quit smoking?,SUPPORTED,NOT ENOUGH INFORMATION
560,Does electromagnetic therapy help heal venous leg ulcers?,SUPPORTED,NOT ENOUGH INFORMATION
563,Can chelation therapy improve symptoms of autism spectrum disorder?,SUPPORTED,REFUTED
566,Is there a beneficial effect of the intervention on patient outcomes?,NOT ENOUGH INFORMATION,REFUTED
571,Do taxane-containing chemotherapy regimens improve outcomes for women with metastatic breast cancer compared to non-taxane regimens?,SUPPORTED,NOT ENOUGH INFORMATION
573,Are pharmacological interventions effective in reducing drug use or criminal activity among drug-using offenders?,REFUTED,NOT ENOUGH INFORMATION
579,Does convective dialysis improve clinical outcomes compared to diffusive dialysis in patients with end-stage kidney disease?,REFUTED,SUPPORTED
580,Does preoperative chemotherapy improve survival in patients with resectable thoracic esophageal cancer?,SUPPORTED,REFUTED
582,Do psychological interventions help people with sickle cell disease cope better with their condition?,SUPPORTED,NOT ENOUGH INFORMATION
586,Is the combination of clindamycin and gentamicin effective for treating postpartum endometritis?,SUPPORTED,NOT ENOUGH INFORMATION
595,Do hormonal contraceptives affect lactation and infant growth?,REFUTED,SUPPORTED
596,Does high frequency oscillatory ventilation reduce the risk of chronic lung disease in preterm infants compared to conventional ventilation?,SUPPORTED,NOT ENOUGH INFORMATION
597,Is optic nerve decompression surgery effective for treating nonarteritic anterior ischemic optic neuropathy?,SUPPORTED,NOT ENOUGH INFORMATION
598,Is there a beneficial effect of the intervention on patient outcomes?,NOT ENOUGH INFORMATION,SUPPORTED
600,Do immunosuppressive agents improve outcomes in multifocal motor neuropathy?,NOT ENOUGH INFORMATION,REFUTED
604,Is a two-step alcohol skin cleansing procedure before blood donation more effective than a one-step procedure in preventing blood contamination?,REFUTED,SUPPORTED
605,Do certain interventions improve the success of turning a breech baby to head first presentation?,REFUTED,SUPPORTED
606,Are fluphenazine decanoate and enanthate more effective than oral antipsychotics for treating schizophrenia?,SUPPORTED,NOT ENOUGH INFORMATION
610,Can palliative radiotherapy improve symptoms in patients with advanced lung cancer?,SUPPORTED,NOT ENOUGH INFORMATION
614,Does patient education help prevent foot ulcers in people with diabetes?,SUPPORTED,REFUTED
615,Does surfactant administration help treat meconium aspiration syndrome in infants?,NOT ENOUGH INFORMATION,SUPPORTED
621,Does careful restriction of water intake in premature infants help reduce the risk of serious health issues?,NOT ENOUGH INFORMATION,SUPPORTED
626,Is there a beneficial effect of the intervention on patient outcomes?,REFUTED,SUPPORTED
628,Should blood pressure be actively lowered during the acute phase of stroke?,SUPPORTED,REFUTED
629,Do antibiotics help improve outcomes for mothers and babies with prelabour rupture of membranes at term?,REFUTED,SUPPORTED
633,Is there a beneficial effect of the treatment on patient outcomes?,REFUTED,SUPPORTED
635,Are interventions effective in reducing the severity of cough in whooping cough?,SUPPORTED,NOT ENOUGH INFORMATION
639,Does wearing compression hosiery help prevent the recurrence of venous ulcers?,NOT ENOUGH INFORMATION,REFUTED
643,Is amphotericin B more effective than fluconazole in reducing morbidity and mortality in cancer patients with neutropenia?,SUPPORTED,REFUTED
644,Do antifungal drugs reduce mortality in cancer patients with neutropenia?,NOT ENOUGH INFORMATION,REFUTED
649,Does advanced life support training for ambulance crews improve outcomes for trauma patients?,SUPPORTED,REFUTED
653,Is magnesium sulphate effective in preventing preterm birth in women in threatened preterm labour?,NOT ENOUGH INFORMATION,SUPPORTED
660,Is praziquantel effective for treating urinary schistosomiasis?,NOT ENOUGH INFORMATION,REFUTED
661,Does the duration of vitamin K antagonist treatment affect the risk of recurrent venous thromboembolism?,REFUTED,NOT ENOUGH INFORMATION
665,Are oral antibiotics effective for treating acute pyelonephritis in children?,SUPPORTED,NOT ENOUGH INFORMATION
666,Is there a beneficial effect of the intervention on patient outcomes?,SUPPORTED,NOT ENOUGH INFORMATION
668,Is there a beneficial effect of the intervention on patient outcomes?,SUPPORTED,REFUTED
669,Does ambulatory oxygen therapy improve exercise capacity in COPD patients who do not qualify for long-term oxygen therapy?,NOT ENOUGH INFORMATION,SUPPORTED
675,Is oral misoprostol effective for inducing labor in women with a viable fetus?,NOT ENOUGH INFORMATION,SUPPORTED
678,Is flupenthixol decanoate effective compared to other treatments for schizophrenia?,SUPPORTED,REFUTED
681,Are longer-acting erythropoiesis-stimulating agents as effective and safe as traditional treatments for anemia in dialysis patients?,SUPPORTED,NOT ENOUGH INFORMATION
682,Does trypanocidal therapy help prevent chronic chagasic cardiomyopathy in infected individuals?,REFUTED,NOT ENOUGH INFORMATION
685,Do group-based parenting programmes improve parental psychosocial wellbeing?,REFUTED,NOT ENOUGH INFORMATION
687,Does bone augmentation improve the success of sinus lift procedures for dental implants?,SUPPORTED,REFUTED
688,Does intermittent pneumatic compression help heal venous leg ulcers?,REFUTED,NOT ENOUGH INFORMATION
694,Is digitalis effective in treating heart failure in patients with normal sinus rhythm?,REFUTED,SUPPORTED
695,Is land-based therapeutic exercise beneficial for people with hip osteoarthritis?,REFUTED,NOT ENOUGH INFORMATION
696,Is physical rehabilitation effective for recovery of function and mobility after a stroke?,NOT ENOUGH INFORMATION,REFUTED
699,Is sulpiride effective for treating schizophrenia compared to placebo?,SUPPORTED,NOT ENOUGH INFORMATION
703,Do hip protectors help reduce the risk of hip fractures in older adults?,NOT ENOUGH INFORMATION,REFUTED
704,Does amnioinfusion for preterm premature rupture of membranes improve perinatal and maternal outcomes?,REFUTED,SUPPORTED
709,Do psychological treatments help people with thalassaemia cope better with their condition?,REFUTED,NOT ENOUGH INFORMATION
712,Do workplace interventions help workers to stop smoking?,NOT ENOUGH INFORMATION,SUPPORTED
714,Does the use of 5-Fluorouracil during glaucoma surgery help lower intraocular pressure?,SUPPORTED,NOT ENOUGH INFORMATION
720,Is buprenorphine effective in managing opioid dependence compared to methadone and placebo?,SUPPORTED,REFUTED
722,Does treatment improve outcomes for twin-twin transfusion syndrome?,SUPPORTED,NOT ENOUGH INFORMATION
726,Is perazine effective for treating schizophrenia compared to other treatments?,REFUTED,NOT ENOUGH INFORMATION
728,Is omalizumab effective in treating asthma compared to placebo or conventional therapy?,NOT ENOUGH INFORMATION,REFUTED
729,Does intravascular brachytherapy help maintain artery openness after angioplasty or stent insertion?,REFUTED,NOT ENOUGH INFORMATION
730,Is chlorpromazine effective for treating schizophrenia compared to placebo?,NOT ENOUGH INFORMATION,SUPPORTED
745,Does single dose dipyrone effectively relieve acute postoperative pain?,SUPPORTED,NOT ENOUGH INFORMATION
749,Does adding prenatal TRH to corticosteroids help prevent neonatal respiratory disease in preterm infants?,REFUTED,SUPPORTED
750,Does screening for oral cancer reduce mortality rates?,REFUTED,NOT ENOUGH INFORMATION
764,Are third wave cognitive and behavioral therapies effective for treating acute depression compared to other psychological therapies?,NOT ENOUGH INFORMATION,SUPPORTED
766,Is valproate effective in the long-term treatment of bipolar disorder?,SUPPORTED,REFUTED
773,Does active chest compression-decompression CPR improve survival or neurological function in cardiac arrest patients?,NOT ENOUGH INFORMATION,SUPPORTED
775,Are metered-dose inhalers with holding chambers as effective as nebulisers for treating acute asthma?,SUPPORTED,NOT ENOUGH INFORMATION
792,Are different antihypertensive drugs equally effective for treating very high blood pressure during pregnancy?,SUPPORTED,NOT ENOUGH INFORMATION
793,Does castor oil effectively induce labor compared to other methods?,REFUTED,NOT ENOUGH INFORMATION
797,Do prison visit programs help reduce delinquency in at-risk youth?,SUPPORTED,NOT ENOUGH INFORMATION
799,Is there a beneficial effect of the intervention on patient outcomes?,REFUTED,NOT ENOUGH INFORMATION
803,Do certain antibiotic prophylaxes help prevent urinary tract infections in adults with short-term catheterization?,SUPPORTED,NOT ENOUGH INFORMATION
804,Do surgical techniques improve outcomes for adults with faecal incontinence compared to non-surgical options?,REFUTED,SUPPORTED
806,Is beta-lactam monotherapy more effective than beta-lactam-aminoglycoside combination therapy for treating febrile neutropenia in cancer patients?,NOT ENOUGH INFORMATION,SUPPORTED
808,Do interventions aimed at supporting parents after perinatal death improve their outcomes?,REFUTED,NOT ENOUGH INFORMATION
809,Are tricyclic drugs effective for treating depression in children and adolescents?,REFUTED,SUPPORTED
817,Is there a preferred pharmaceutical treatment for infantile spasms that effectively controls seizures and improves long-term outcomes?,REFUTED,NOT ENOUGH INFORMATION
818,Does mammographic screening for breast cancer reduce mortality?,NOT ENOUGH INFORMATION,SUPPORTED
819,Does increasing fruit and vegetable consumption help prevent cardiovascular disease?,REFUTED,SUPPORTED
820,Do glucocorticoids improve outcomes in children with acute viral bronchiolitis?,NOT ENOUGH INFORMATION,SUPPORTED
822,Is autoinflation an effective treatment for otitis media with effusion?,SUPPORTED,NOT ENOUGH INFORMATION
823,Is etanercept more effective than traditional DMARDs for treating rheumatoid arthritis?,NOT ENOUGH INFORMATION,REFUTED
827,Does folic or folinic acid supplementation reduce side effects in rheumatoid arthritis patients treated with methotrexate?,REFUTED,SUPPORTED
829,"Are different thrombolytic agents, doses, and routes of administration effective for treating acute ischaemic stroke?",REFUTED,NOT ENOUGH INFORMATION
838,Is therapeutic ultrasound effective for treating carpal tunnel syndrome?,NOT ENOUGH INFORMATION,SUPPORTED
839,Does thromboprophylaxis reduce mortality in trauma patients?,SUPPORTED,NOT ENOUGH INFORMATION
843,Is there a specific functional treatment strategy that is most effective for acute lateral ankle ligament ruptures?,SUPPORTED,REFUTED
847,Is buflomedil effective for treating intermittent claudication?,NOT ENOUGH INFORMATION,SUPPORTED
853,Is transpyloric feeding more beneficial than gastric feeding for preterm infants?,NOT ENOUGH INFORMATION,REFUTED
857,Does personalised risk communication improve informed decision making for screening tests?,NOT ENOUGH INFORMATION,SUPPORTED
862,Is it safe for obese pregnant women to intentionally lose weight during pregnancy?,REFUTED,NOT ENOUGH INFORMATION
864,Does therapeutic hypothermia improve outcomes for newborns with hypoxic ischaemic encephalopathy?,SUPPORTED,NOT ENOUGH INFORMATION
866,Are pressure-relieving interventions effective in healing foot ulcers in people with diabetes?,NOT ENOUGH INFORMATION,SUPPORTED
867,Does Ginkgo biloba extract help prevent the progression of age-related macular degeneration?,NOT ENOUGH INFORMATION,SUPPORTED
875,Does adding intravenous aminophylline to inhaled beta(2)-agonists improve treatment outcomes for adults with acute asthma in the emergency department?,SUPPORTED,NOT ENOUGH INFORMATION
877,Do inhaled corticosteroids help reduce hospital admissions for patients with acute asthma?,REFUTED,SUPPORTED
880,Are different interventions effective for treating vaginismus?,SUPPORTED,REFUTED
883,Does ursodeoxycholic acid provide significant benefits for patients with primary biliary cirrhosis?,NOT ENOUGH INFORMATION,SUPPORTED
887,Do different skin closure techniques after caesarean section affect maternal outcomes?,REFUTED,NOT ENOUGH INFORMATION
889,Do macrolide antibiotics improve clinical status in people with cystic fibrosis?,SUPPORTED,REFUTED
890,Does rhIGF-I treatment have a positive effect on disease progression in ALS?,SUPPORTED,NOT ENOUGH INFORMATION
891,Is depot bromperidol more effective than placebo for treating schizophrenia?,SUPPORTED,NOT ENOUGH INFORMATION
892,Does early surfactant therapy improve outcomes for newborns with respiratory distress?,REFUTED,NOT ENOUGH INFORMATION
894,Are antibiotics effective for treating non-typhoidal Salmonella diarrhoea in healthy individuals?,REFUTED,NOT ENOUGH INFORMATION
900,Is methenamine hippurate effective in preventing urinary tract infections in patients without renal tract abnormalities?,NOT ENOUGH INFORMATION,REFUTED
906,Do air ionisers help reduce asthma symptoms?,REFUTED,NOT ENOUGH INFORMATION
908,Do treatments to reduce fever in malaria affect the course of the illness?,SUPPORTED,NOT ENOUGH INFORMATION
912,Can the Alexander technique help improve symptoms in people with chronic asthma?,SUPPORTED,NOT ENOUGH INFORMATION
918,Do psychological interventions have beneficial effects for borderline personality disorder?,SUPPORTED,REFUTED
919,Does exclusive breastfeeding for six months improve child health compared to shorter durations?,REFUTED,NOT ENOUGH INFORMATION
921,Is speech and language therapy effective for improving speech problems in Parkinson's disease?,SUPPORTED,NOT ENOUGH INFORMATION
924,Is prophylactic use of prostaglandins effective in managing the third stage of labour?,SUPPORTED,NOT ENOUGH INFORMATION
925,Does hormone therapy with both estrogen and progestogen effectively protect against endometrial hyperplasia?,SUPPORTED,NOT ENOUGH INFORMATION
926,Do biochemical tests of placental function improve outcomes in high-risk pregnancies?,SUPPORTED,REFUTED
929,Do biofeedback and anal sphincter exercises improve faecal incontinence in adults?,REFUTED,NOT ENOUGH INFORMATION
931,Do opioids effectively relieve breathlessness in patients receiving palliative care?,SUPPORTED,REFUTED
937,Is there a clear best treatment for isolated fractures of the ulnar shaft in adults?,SUPPORTED,NOT ENOUGH INFORMATION
941,Are totally implantable venous access devices safe and effective for administering intravenous antibiotics in people with cystic fibrosis?,REFUTED,NOT ENOUGH INFORMATION
942,Is treating acute exacerbations of COPD at home effective compared to hospital inpatient care?,REFUTED,SUPPORTED
947,Are primary care based asthma clinics effective in managing asthma?,SUPPORTED,NOT ENOUGH INFORMATION
956,Does riluzole prolong survival in patients with amyotrophic lateral sclerosis?,SUPPORTED,NOT ENOUGH INFORMATION
959,Are flapless dental implant procedures beneficial for patients?,SUPPORTED,REFUTED
960,Do antipsychotic drugs have effects on elderly people with late-onset schizophrenia?,NOT ENOUGH INFORMATION,SUPPORTED
962,Is there a better surgical method for improving or replacing bladder function using intestinal segments?,NOT ENOUGH INFORMATION,SUPPORTED
967,Do organisational infrastructures effectively promote evidence-based nursing?,REFUTED,NOT ENOUGH INFORMATION
972,Do certain antibiotic regimens effectively reduce infections after cesarean sections?,SUPPORTED,NOT ENOUGH INFORMATION
975,Are life skills programmes effective for improving outcomes in people with chronic mental health problems?,SUPPORTED,NOT ENOUGH INFORMATION
977,Do complementary interventions have an effect on bedwetting in children?,REFUTED,NOT ENOUGH INFORMATION
978,Is day hospital care as effective as inpatient care for acute psychiatric disorders?,NOT ENOUGH INFORMATION,SUPPORTED
979,Is prescribing heroin to opioid-dependent individuals more effective than traditional treatments like methadone?,REFUTED,NOT ENOUGH INFORMATION
982,Do behavioural interventions improve faecal incontinence in children?,NOT ENOUGH INFORMATION,SUPPORTED
987,Is oral immunoglobulin effective in preventing rotavirus infection in low birthweight infants?,NOT ENOUGH INFORMATION,SUPPORTED
988,Is there a best surgical technique for treating chronic anal fissures?,NOT ENOUGH INFORMATION,SUPPORTED
996,Are psychosocial interventions effective in improving outcomes for opioid detoxification when combined with pharmacological treatments?,NOT ENOUGH INFORMATION,SUPPORTED
998,Are psychosocial and educational interventions effective in preventing alcohol misuse among young people?,SUPPORTED,NOT ENOUGH INFORMATION
1005,Does a single dose of dexamethasone reduce complications after tonsillectomy?,SUPPORTED,NOT ENOUGH INFORMATION
1006,Does cot-nursing provide similar benefits to incubator care for preterm infants?,NOT ENOUGH INFORMATION,SUPPORTED
1007,Is anticoagulant therapy effective and safe for treating cerebral venous sinus thrombosis?,SUPPORTED,REFUTED
1008,Is there an effective treatment for Achilles tendinitis?,SUPPORTED,NOT ENOUGH INFORMATION
1009,Do antiretroviral regimens effectively reduce the risk of mother-to-child transmission of HIV?,NOT ENOUGH INFORMATION,SUPPORTED
1012,Does providing a written asthma self-management plan improve treatment adherence and outcomes?,SUPPORTED,NOT ENOUGH INFORMATION
1013,Are community-based interventions effective in preventing young people from starting to smoke?,REFUTED,NOT ENOUGH INFORMATION
1014,Do interventions help prevent lower limb soft-tissue injuries in runners?,SUPPORTED,NOT ENOUGH INFORMATION
1019,Does propylthiouracil have beneficial effects for patients with alcoholic liver disease?,REFUTED,NOT ENOUGH INFORMATION
1020,Does platinum-based chemotherapy improve survival in patients with locally advanced bladder cancer?,SUPPORTED,NOT ENOUGH INFORMATION
1026,Is primary radiotherapy to the groin as effective and safe as surgery for early vulvar cancer?,REFUTED,NOT ENOUGH INFORMATION
1027,Do steroids help improve hearing loss in children with otitis media with effusion?,SUPPORTED,REFUTED
1032,Does naltrexone maintenance treatment effectively prevent relapse in opioid addicts after detoxification?,SUPPORTED,REFUTED
1034,Does increased folate consumption reduce the risk of neural tube defects?,SUPPORTED,NOT ENOUGH INFORMATION
1035,Do behavioural interventions for young women effectively promote safer sexual behaviours to prevent STIs and cervical cancer?,NOT ENOUGH INFORMATION,REFUTED
1037,Is cognitive behavioural therapy more effective than other psychological therapies for people with schizophrenia?,NOT ENOUGH INFORMATION,SUPPORTED
1040,Is gabapentin effective for managing neuropathic pain?,NOT ENOUGH INFORMATION,REFUTED
1043,Do parenting programmes improve outcomes for teenage parents and their children?,NOT ENOUGH INFORMATION,REFUTED
1044,Is one technique of tonsillectomy better than the other in terms of morbidity?,NOT ENOUGH INFORMATION,REFUTED
1045,Do anti-fibrinolytic drugs reduce blood loss and the need for blood transfusion during surgery?,SUPPORTED,NOT ENOUGH INFORMATION
1048,Does reducing dietary sodium improve asthma control?,NOT ENOUGH INFORMATION,REFUTED
1056,Are anti-secretory drugs effective in improving symptoms of non-ulcer dyspepsia?,REFUTED,NOT ENOUGH INFORMATION
1068,Does magnesium sulphate reduce the risk of seizures and maternal death in women with eclampsia compared to diazepam?,NOT ENOUGH INFORMATION,REFUTED
1069,Do family psychosocial interventions help reduce relapses in people with schizophrenia?,SUPPORTED,NOT ENOUGH INFORMATION
1075,Is autologous chondrocyte implantation effective and safe for treating knee cartilage defects?,NOT ENOUGH INFORMATION,REFUTED
1080,Do non-steroid agents improve outcomes in adults with idiopathic pulmonary fibrosis?,SUPPORTED,NOT ENOUGH INFORMATION
1081,Is magnesium sulphate more effective than lytic cocktail for treating eclampsia?,SUPPORTED,NOT ENOUGH INFORMATION
1082,Does antibiotic prophylaxis reduce bacterial infections in cirrhotic patients with upper gastrointestinal bleeding?,SUPPORTED,REFUTED
1083,Is vacuum aspiration a safer and more effective method for managing incomplete miscarriage compared to sharp curettage?,SUPPORTED,NOT ENOUGH INFORMATION
1084,Are longer courses of antibiotics more effective than shorter courses for treating acute otitis media in children?,NOT ENOUGH INFORMATION,SUPPORTED
1085,Do treatments for nausea and vomiting in early pregnancy have beneficial effects?,REFUTED,SUPPORTED
1087,Is there an effective treatment for oral mucositis in cancer patients undergoing chemotherapy or radiotherapy?,REFUTED,NOT ENOUGH INFORMATION
1089,Is aerobic exercise safe and beneficial for adults living with HIV?,SUPPORTED,NOT ENOUGH INFORMATION
1091,Are injected cholera vaccines effective in preventing cholera and death?,SUPPORTED,NOT ENOUGH INFORMATION
1098,Does prophylactic indomethacin reduce mortality and morbidity in preterm infants?,NOT ENOUGH INFORMATION,REFUTED
1102,Is resting in bed effective for treating acute low-back pain or sciatica?,SUPPORTED,NOT ENOUGH INFORMATION
1104,Does adding long-acting inhaled beta-agonists to inhaled corticosteroids improve asthma control in patients not well managed on corticosteroids alone?,NOT ENOUGH INFORMATION,SUPPORTED
1105,Is glatiramer acetate effective for treating relapsing remitting multiple sclerosis?,SUPPORTED,NOT ENOUGH INFORMATION
1122,Do placebo interventions generally have important clinical effects?,NOT ENOUGH INFORMATION,SUPPORTED
1125,Do scapular fixation techniques improve upper limb function in muscular dystrophy?,NOT ENOUGH INFORMATION,SUPPORTED
1133,Are antibiotics effective and safe for treating leptospirosis?,SUPPORTED,NOT ENOUGH INFORMATION
1137,Does antenatal cardiotocography improve perinatal and maternal outcomes?,SUPPORTED,NOT ENOUGH INFORMATION
1143,Does TB preventive therapy reduce the risk of active tuberculosis in HIV-infected individuals?,SUPPORTED,NOT ENOUGH INFORMATION
1144,Does giving phenobarbital to women at risk of preterm birth help prevent brain injuries in their infants?,REFUTED,NOT ENOUGH INFORMATION
1145,Does intrapartum antibiotic treatment for women colonized with group B streptococcus reduce the risk of neonatal infection?,SUPPORTED,NOT ENOUGH INFORMATION
1147,Is clomiphene citrate effective in improving pregnancy outcomes for women with unexplained subfertility?,SUPPORTED,REFUTED
1150,Do shorter fasting periods before surgery improve comfort and reduce complications in children?,SUPPORTED,REFUTED
1152,Is rofecoxib effective for treating moderate to severe postoperative pain?,REFUTED,SUPPORTED
1153,Is enamel matrix derivative effective for treating intrabony defects in periodontitis?,NOT ENOUGH INFORMATION,REFUTED
1154,Are augmentation procedures necessary for dental implants in patients with insufficient bone?,SUPPORTED,NOT ENOUGH INFORMATION
1160,Is video-assisted thoracoscopic surgery more effective than chest tube drainage for treating large pleural empyemas?,SUPPORTED,NOT ENOUGH INFORMATION
1166,Is cognitive behavioural therapy effective for treating bulimia nervosa and related eating disorders?,NOT ENOUGH INFORMATION,SUPPORTED
1170,Is high frequency oscillatory ventilation more effective than conventional ventilation for infants with severe respiratory failure?,REFUTED,SUPPORTED
1183,Are nasal decongestants effective in relieving nasal congestion caused by the common cold?,REFUTED,SUPPORTED
1184,Is postoperative hydrotubation beneficial after female pelvic reproductive surgery?,SUPPORTED,NOT ENOUGH INFORMATION
1186,Do interventions for correcting hallux valgus improve patient outcomes?,NOT ENOUGH INFORMATION,SUPPORTED
1189,Do interventions exist that can reduce falls in elderly people?,REFUTED,SUPPORTED
1191,Is spironolactone effective in reducing excessive hair growth in women?,REFUTED,NOT ENOUGH INFORMATION
1192,Is inhaled insulin as effective as injected insulin for managing diabetes?,REFUTED,SUPPORTED
1193,Does estrogen replacement therapy help improve cognitive function in postmenopausal women with dementia?,NOT ENOUGH INFORMATION,SUPPORTED
1195,Are antipsychotic medications effective in treating amphetamine psychosis?,NOT ENOUGH INFORMATION,SUPPORTED
1196,Is biopsychosocial rehabilitation effective for treating upper limb repetitive strain injuries?,SUPPORTED,NOT ENOUGH INFORMATION
